{
  "technique": "boomerang",
  "scrape_info": {
    "timestamp": "20250911_075147",
    "total_videos": 6,
    "scraper_type": "comprehensive_popup_modal"
  },
  "videos": [
    {
      "video_url": "https://asset.eyecannndy.com/media/clip/2025/02/10/261739192401.webp",
      "alt_text": "Static - Federer",
      "discovered_at": "2025-09-11T07:51:30.089429",
      "title": "Static - Federer (2025)",
      "description": "",
      "tags": [
        "DAY",
        "MALE",
        "EXTERIOR",
        "COURT",
        "TENNIS"
      ],
      "technique_tags": [
        "Boomerang"
      ],
      "director": "Din Perlis",
      "dop": "",
      "colorist": "",
      "original_source": "",
      "additional_info": "Static - Federer (2025)\nDirected, filmed, and edited by Din Perlis, with production led by Hatzub, the video has been highlighted for its exceptional visual storytelling. Directed, Filmed and Edited by @dinperlis Production House : @hatzub Head Producer : @hatzub Executive Producer : @orbarak10 Gaffer : @yanaimoradi 3D & VFX : @dyln.films Coloring : @dinperlis Sound Design : @kai.goodrem Talent Styling : @kimeliyahu Actors Styling : @sarah.elalouf Art Director : @sarah.elalouf PA : @kobefunt PA : @tzur_h BTS : @nnnnoya BTS : @edenush02 Makeup Artist : @makeup.by.roni_ Makeup Assistant : @maayan_ashkenazi_makeup Actors Makeup : @alinshabtay Actors : yardenlasry / @rotem.landesberg Hair Stylist : @oshri.shushan Extras : @sharonann_26 / @hila.atdgi / @sn0rka Artist Management : @gagamanagement Rep : @roms_studios\nTechnique - Boomerang\nDirector - Din Perlis\nOriginal Source - Link\nDAY\nMALE\nEXTERIOR\nCOURT\nTENNIS",
      "page_url": "https://eyecannndy.com/technique/boomerang"
    },
    {
      "video_url": "https://asset.eyecannndy.com/media/clip/2025/02/10/261739191986.webp",
      "alt_text": "Static - Federer",
      "discovered_at": "2025-09-11T07:51:33.720469",
      "title": "Static - Federer (2025)",
      "description": "",
      "tags": [
        "DAY",
        "EXTERIOR",
        "COURT",
        "TENNIS BALL",
        "TENNIS"
      ],
      "technique_tags": [
        "Boomerang",
        "Suggestive"
      ],
      "director": "Din Perlis",
      "dop": "",
      "colorist": "",
      "original_source": "",
      "additional_info": "Static - Federer (2025)\nDirected, filmed, and edited by Din Perlis, with production led by Hatzub, the video has been highlighted for its exceptional visual storytelling. Directed, Filmed and Edited by @dinperlis Production House : @hatzub Head Producer : @hatzub Executive Producer : @orbarak10 Gaffer : @yanaimoradi 3D & VFX : @dyln.films Coloring : @dinperlis Sound Design : @kai.goodrem Talent Styling : @kimeliyahu Actors Styling : @sarah.elalouf Art Director : @sarah.elalouf PA : @kobefunt PA : @tzur_h BTS : @nnnnoya BTS : @edenush02 Makeup Artist : @makeup.by.roni_ Makeup Assistant : @maayan_ashkenazi_makeup Actors Makeup : @alinshabtay Actors : yardenlasry / @rotem.landesberg Hair Stylist : @oshri.shushan Extras : @sharonann_26 / @hila.atdgi / @sn0rka Artist Management : @gagamanagement Rep : @roms_studios\nTechnique - Boomerang , Suggestive\nDirector - Din Perlis\nOriginal Source - Link\nDAY\nEXTERIOR\nCOURT\nTENNIS BALL\nTENNIS",
      "page_url": "https://eyecannndy.com/technique/boomerang"
    },
    {
      "video_url": "https://asset.eyecannndy.com/media/clip/2024/07/05/261720165679.webp",
      "alt_text": "Victoria Monet - Alright",
      "discovered_at": "2025-09-11T07:51:36.842773",
      "title": "Victoria Monet - Alright (2024)",
      "description": "The music video for \"Alright\" by Victoria Monét, directed by Dave Meyers, is a vibrant homage to Janet Jackson, featuring high-energy choreography and striking visuals. In the video, Monét channels Jackson's iconic style, wearing a black-and-white fedora and suit, and performing dynamic dance routines reminiscent of Jackson's 1990s and 2000s era. The video, choreographed by Sean Bankhead, showcases Monét's impressive dance skills and captures the essence of liberation and celebration. Made in collaboration with Jacobi Mehringer, Anna Arnell, and Mia Barnes.",
      "tags": [
        "VICTORIA MONET"
      ],
      "technique_tags": [
        "Boomerang",
        "Choreo"
      ],
      "director": "Vinnie Hobbs",
      "dop": "Scott Cunningham",
      "colorist": "Dante Pasquinelli",
      "original_source": "",
      "additional_info": "Victoria Monet - Alright (2024)\nThe music video for \"Alright\" by Victoria Monét, directed by Dave Meyers, is a vibrant homage to Janet Jackson, featuring high-energy choreography and striking visuals. In the video, Monét channels Jackson's iconic style, wearing a black-and-white fedora and suit, and performing dynamic dance routines reminiscent of Jackson's 1990s and 2000s era. The video, choreographed by Sean Bankhead, showcases Monét's impressive dance skills and captures the essence of liberation and celebration. Made in collaboration with Jacobi Mehringer, Anna Arnell, and Mia Barnes.\nTechnique - Boomerang , Choreo\nDirector - Dave Meyers\nDOP - Scott Cunningham\nEditor - Vinnie Hobbs\nColorist - Dante Pasquinelli\nOriginal Source - Link\nVICTORIA MONET",
      "page_url": "https://eyecannndy.com/technique/boomerang"
    },
    {
      "video_url": "https://asset.eyecannndy.com/media/clip/2024/07/05/261720165642.webp",
      "alt_text": "Victoria Monet - Alright",
      "discovered_at": "2025-09-11T07:51:40.508606",
      "title": "Victoria Monet - Alright (2024)",
      "description": "The music video for \"Alright\" by Victoria Monét, directed by Dave Meyers, is a vibrant homage to Janet Jackson, featuring high-energy choreography and striking visuals. In the video, Monét channels Jackson's iconic style, wearing a black-and-white fedora and suit, and performing dynamic dance routines reminiscent of Jackson's 1990s and 2000s era. The video, choreographed by Sean Bankhead, showcases Monét's impressive dance skills and captures the essence of liberation and celebration. Made in collaboration with Jacobi Mehringer, Anna Arnell, and Mia Barnes.",
      "tags": [
        "VICTORIA MONET"
      ],
      "technique_tags": [
        "Boomerang",
        "Choreo"
      ],
      "director": "Vinnie Hobbs",
      "dop": "Scott Cunningham",
      "colorist": "Dante Pasquinelli",
      "original_source": "",
      "additional_info": "Victoria Monet - Alright (2024)\nThe music video for \"Alright\" by Victoria Monét, directed by Dave Meyers, is a vibrant homage to Janet Jackson, featuring high-energy choreography and striking visuals. In the video, Monét channels Jackson's iconic style, wearing a black-and-white fedora and suit, and performing dynamic dance routines reminiscent of Jackson's 1990s and 2000s era. The video, choreographed by Sean Bankhead, showcases Monét's impressive dance skills and captures the essence of liberation and celebration. Made in collaboration with Jacobi Mehringer, Anna Arnell, and Mia Barnes.\nTechnique - Boomerang , Choreo\nDirector - Dave Meyers\nDOP - Scott Cunningham\nEditor - Vinnie Hobbs\nColorist - Dante Pasquinelli\nOriginal Source - Link\nVICTORIA MONET",
      "page_url": "https://eyecannndy.com/technique/boomerang"
    },
    {
      "video_url": "https://asset.eyecannndy.com/media/clip/2024/07/05/261720165706.webp",
      "alt_text": "Victoria Monet - Alright",
      "discovered_at": "2025-09-11T07:51:44.145417",
      "title": "Victoria Monet - Alright (2024)",
      "description": "The music video for \"Alright\" by Victoria Monét, directed by Dave Meyers, is a vibrant homage to Janet Jackson, featuring high-energy choreography and striking visuals. In the video, Monét channels Jackson's iconic style, wearing a black-and-white fedora and suit, and performing dynamic dance routines reminiscent of Jackson's 1990s and 2000s era. The video, choreographed by Sean Bankhead, showcases Monét's impressive dance skills and captures the essence of liberation and celebration. Made in collaboration with Jacobi Mehringer, Anna Arnell, and Mia Barnes.",
      "tags": [
        "VICTORIA MONET"
      ],
      "technique_tags": [
        "Boomerang",
        "Choreo"
      ],
      "director": "Vinnie Hobbs",
      "dop": "Scott Cunningham",
      "colorist": "Dante Pasquinelli",
      "original_source": "",
      "additional_info": "Victoria Monet - Alright (2024)\nThe music video for \"Alright\" by Victoria Monét, directed by Dave Meyers, is a vibrant homage to Janet Jackson, featuring high-energy choreography and striking visuals. In the video, Monét channels Jackson's iconic style, wearing a black-and-white fedora and suit, and performing dynamic dance routines reminiscent of Jackson's 1990s and 2000s era. The video, choreographed by Sean Bankhead, showcases Monét's impressive dance skills and captures the essence of liberation and celebration. Made in collaboration with Jacobi Mehringer, Anna Arnell, and Mia Barnes.\nTechnique - Boomerang , Choreo\nDirector - Dave Meyers\nDOP - Scott Cunningham\nEditor - Vinnie Hobbs\nColorist - Dante Pasquinelli\nOriginal Source - Link\nVICTORIA MONET",
      "page_url": "https://eyecannndy.com/technique/boomerang"
    },
    {
      "video_url": "https://asset.eyecannndy.com/media/clip/2024/07/05/261720165749.webp",
      "alt_text": "Victoria Monet - Alright",
      "discovered_at": "2025-09-11T07:51:47.259207",
      "title": "Victoria Monet - Alright (2024)",
      "description": "The music video for \"Alright\" by Victoria Monét, directed by Dave Meyers, is a vibrant homage to Janet Jackson, featuring high-energy choreography and striking visuals. In the video, Monét channels Jackson's iconic style, wearing a black-and-white fedora and suit, and performing dynamic dance routines reminiscent of Jackson's 1990s and 2000s era. The video, choreographed by Sean Bankhead, showcases Monét's impressive dance skills and captures the essence of liberation and celebration. Made in collaboration with Jacobi Mehringer, Anna Arnell, and Mia Barnes.",
      "tags": [
        "VICTORIA MONET"
      ],
      "technique_tags": [
        "Boomerang",
        "Choreo"
      ],
      "director": "Vinnie Hobbs",
      "dop": "Scott Cunningham",
      "colorist": "Dante Pasquinelli",
      "original_source": "",
      "additional_info": "Victoria Monet - Alright (2024)\nThe music video for \"Alright\" by Victoria Monét, directed by Dave Meyers, is a vibrant homage to Janet Jackson, featuring high-energy choreography and striking visuals. In the video, Monét channels Jackson's iconic style, wearing a black-and-white fedora and suit, and performing dynamic dance routines reminiscent of Jackson's 1990s and 2000s era. The video, choreographed by Sean Bankhead, showcases Monét's impressive dance skills and captures the essence of liberation and celebration. Made in collaboration with Jacobi Mehringer, Anna Arnell, and Mia Barnes.\nTechnique - Boomerang , Choreo\nDirector - Dave Meyers\nDOP - Scott Cunningham\nEditor - Vinnie Hobbs\nColorist - Dante Pasquinelli\nOriginal Source - Link\nVICTORIA MONET",
      "page_url": "https://eyecannndy.com/technique/boomerang"
    }
  ]
}