{
  "technique": "halation",
  "scrape_info": {
    "timestamp": "20250912_063326",
    "total_videos": 24,
    "scraper_type": "comprehensive_popup_modal"
  },
  "videos": [
    {
      "video_url": "https://asset.eyecannndy.com/media/CACHE/images/clip/2024/05/14/Oble_Reed_-_WESTON._Official_Music_Video_Xi3tykV/1514e65bf709368324e176e035607858.gif",
      "alt_text": "Oblé Reed - WESTON.",
      "discovered_at": "2025-09-12T06:32:05.968332",
      "title": "Oblé Reed - WESTON. (2023)",
      "description": "Oblé Reed - WESTON. (2023)\nMusic video\nTechnique - Halation\nDirector - Nash Pearson\nEditor - Nash Pearson\nOriginal Source - Link\nMALE\nROAD\nNIGHT\nEXTERIOR",
      "tags": [
        "MALE",
        "ROAD",
        "NIGHT",
        "EXTERIOR"
      ],
      "technique_tags": [
        "Halation"
      ],
      "director": "Nash Pearson",
      "dop": "",
      "colorist": "",
      "original_source": "",
      "additional_info": "Oblé Reed - WESTON. (2023)\nMusic video\nTechnique - Halation\nDirector - Nash Pearson\nEditor - Nash Pearson\nOriginal Source - Link\nMALE\nROAD\nNIGHT\nEXTERIOR",
      "page_url": "https://eyecannndy.com/technique/halation"
    },
    {
      "video_url": "https://asset.eyecannndy.com/media/clip/2024/07/13/261720850488.webp",
      "alt_text": "Jhula - Manish Khushalani",
      "discovered_at": "2025-09-12T06:32:10.645362",
      "title": "Jhula - Manish Khushalani (2024)",
      "description": "The music video for \"Jhula\" by Manish Khushalani, released in 2024, explores themes of vulnerability, trust, and the delicate nature of relationships. The video combines Indian classical elements with contemporary electronic music, creating a unique visual and auditory experience. The narrative is driven by a series of intimate and evocative scenes that reflect the song's emotional depth, showcasing a blend of traditional and modern aesthetics that highlight the fusion of cultural influences. The visuals are crafted to complement the haunting melody and poignant lyrics, making for a captivating and immersive experience.",
      "tags": [
        "INTERIOR",
        "TWO SHOT",
        "HANDHELD"
      ],
      "technique_tags": [
        "Halation"
      ],
      "director": "Manish Khushalani",
      "dop": "",
      "colorist": "Vineesh Vijayan",
      "original_source": "",
      "additional_info": "Jhula - Manish Khushalani (2024)\nThe music video for \"Jhula\" by Manish Khushalani, released in 2024, explores themes of vulnerability, trust, and the delicate nature of relationships. The video combines Indian classical elements with contemporary electronic music, creating a unique visual and auditory experience. The narrative is driven by a series of intimate and evocative scenes that reflect the song's emotional depth, showcasing a blend of traditional and modern aesthetics that highlight the fusion of cultural influences. The visuals are crafted to complement the haunting melody and poignant lyrics, making for a captivating and immersive experience.\nTechnique - Halation\nDirector - Manish Khushalani\nEditor - Manish Khushalani\nColorist - Vineesh Vijayan\nOriginal Source - Link\nINTERIOR\nTWO SHOT\nHANDHELD",
      "page_url": "https://eyecannndy.com/technique/halation"
    },
    {
      "video_url": "https://asset.eyecannndy.com/media/clip/2024/03/13/261710332797.webp",
      "alt_text": "Our England",
      "discovered_at": "2025-09-12T06:32:13.777249",
      "title": "Our England (2022)",
      "description": "England's women's football team, the Lionesses, aims for glory in the UEFA Women’s Euro 2022, and they've recruited a director and illustrator to make it a sticker-filled trip down nostalgia lane. Because, you know, we all fondly remember those panini stickers from our youth.",
      "tags": [
        "WOMAN",
        "SPORTS",
        "INTERIOR",
        "BAR",
        "FAN"
      ],
      "technique_tags": [
        "Halation",
        "Indifference",
        "Video Portraits"
      ],
      "director": "India Harris",
      "dop": "",
      "colorist": "",
      "original_source": "",
      "additional_info": "Our England (2022)\nEngland's women's football team, the Lionesses, aims for glory in the UEFA Women’s Euro 2022, and they've recruited a director and illustrator to make it a sticker-filled trip down nostalgia lane. Because, you know, we all fondly remember those panini stickers from our youth.\nTechnique - Halation , Indifference , Video Portraits\nDirector - India Harris\nOriginal Source - Link\nWOMAN\nSPORTS\nINTERIOR\nBAR\nFAN",
      "page_url": "https://eyecannndy.com/technique/halation"
    },
    {
      "video_url": "https://asset.eyecannndy.com/media/clip/2024/09/12/261726174604.webp",
      "alt_text": "M.I.A. 'Bad Girls'",
      "discovered_at": "2025-09-12T06:32:17.417477",
      "title": "M.I.A. 'Bad Girls' (2012)",
      "description": "M.I.A.'s \"Bad Girls\" music video is a visually stunning showcase of Saudi-inspired car stunts, with drifting vehicles on two wheels and empowered women in a desert setting, blending Middle Eastern cultural elements with modern rebellion. Directed by Romain Gavras, the video highlights themes of female empowerment and defiance, all set against a backdrop of high-octane action and surreal imagery.",
      "tags": [
        "MALE",
        "GROUP",
        "DESERT",
        "MOROCCO"
      ],
      "technique_tags": [
        "Halation",
        "Pan"
      ],
      "director": "Walter Mauriot",
      "dop": "André Chemetoff",
      "colorist": "",
      "original_source": "",
      "additional_info": "M.I.A. 'Bad Girls' (2012)\nM.I.A.'s \"Bad Girls\" music video is a visually stunning showcase of Saudi-inspired car stunts, with drifting vehicles on two wheels and empowered women in a desert setting, blending Middle Eastern cultural elements with modern rebellion. Directed by Romain Gavras, the video highlights themes of female empowerment and defiance, all set against a backdrop of high-octane action and surreal imagery.\nTechnique - Halation , Pan\nDirector - Romain Gavras\nDOP - André Chemetoff\nEditor - Walter Mauriot\nOriginal Source - Link\nTutorial - Link\nMALE\nGROUP\nDESERT\nMOROCCO",
      "page_url": "https://eyecannndy.com/technique/halation"
    },
    {
      "video_url": "https://asset.eyecannndy.com/media/clip/2024/03/10/261710034197.webp",
      "alt_text": "The Gentlemen (TV Series)",
      "discovered_at": "2025-09-12T06:32:20.502980",
      "title": "The Gentlemen (TV Series) (2024)",
      "description": "Eddie Horniman inherits a family estate, initially unaware its home to a drug empire run by a syndicate that has no plans to vacate. Created by Guy Ritchie.",
      "tags": [
        "DRIVING",
        "INTERIOR",
        "LIME GREEN",
        "LAMBORGHINI"
      ],
      "technique_tags": [
        "Halation"
      ],
      "director": "David Webb",
      "dop": "Bjorn Charpentier",
      "colorist": "",
      "original_source": "",
      "additional_info": "The Gentlemen (TV Series) (2024)\nEddie Horniman inherits a family estate, initially unaware its home to a drug empire run by a syndicate that has no plans to vacate. Created by Guy Ritchie.\nTechnique - Halation\nDOP - Bjorn Charpentier\nEditor - David Webb\nDRIVING\nINTERIOR\nLIME GREEN\nLAMBORGHINI",
      "page_url": "https://eyecannndy.com/technique/halation"
    },
    {
      "video_url": "https://asset.eyecannndy.com/media/clip/2024/03/26/261711434366.webp",
      "alt_text": "\"The Fear Cycle\" Film - Unveiling Sleep Paralysis Through Art",
      "discovered_at": "2025-09-12T06:32:24.150843",
      "title": "\"The Fear Cycle\" Film - Unveiling Sleep Paralysis Through Art (2024)",
      "description": "\"The Fear Cycle\" film explores Nicolas Bruno’s experiences with Sleep Paralysis, a sleep disorder that causes vivid nightmares. Bruno transforms his fears into artwork, giving viewers a glimpse into each dream sequence. This film delves into Bruno's creative journey, showcasing his artistic process, dream journal entries, and theatrical renditions of his visions.",
      "tags": [
        "DAY",
        "WALKING",
        "EXTERIOR",
        "SUN",
        "RAINBOW",
        "HIKING",
        "RAY"
      ],
      "technique_tags": [
        "Halation",
        "Slow Motion"
      ],
      "director": "Armen Harootun",
      "dop": "",
      "colorist": "Connor Bailey",
      "original_source": "",
      "additional_info": "\"The Fear Cycle\" Film - Unveiling Sleep Paralysis Through Art (2024)\n\"The Fear Cycle\" film explores Nicolas Bruno’s experiences with Sleep Paralysis, a sleep disorder that causes vivid nightmares. Bruno transforms his fears into artwork, giving viewers a glimpse into each dream sequence. This film delves into Bruno's creative journey, showcasing his artistic process, dream journal entries, and theatrical renditions of his visions.\nTechnique - Halation , Slow Motion\nDirector - Dexter Brierley, Matthew Seger\nEditor - Armen Harootun\nColorist - Connor Bailey\nOriginal Source - Link\nDAY\nWALKING\nEXTERIOR\nSUN\nRAINBOW\nHIKING\nRAY",
      "page_url": "https://eyecannndy.com/technique/halation"
    },
    {
      "video_url": "https://asset.eyecannndy.com/media/clip/2024/07/13/261720851055.webp",
      "alt_text": "Jhula - Manish Khushalani",
      "discovered_at": "2025-09-12T06:32:27.779566",
      "title": "Jhula - Manish Khushalani (2024)",
      "description": "The music video for \"Jhula\" by Manish Khushalani, released in 2024, explores themes of vulnerability, trust, and the delicate nature of relationships. The video combines Indian classical elements with contemporary electronic music, creating a unique visual and auditory experience. The narrative is driven by a series of intimate and evocative scenes that reflect the song's emotional depth, showcasing a blend of traditional and modern aesthetics that highlight the fusion of cultural influences. The visuals are crafted to complement the haunting melody and poignant lyrics, making for a captivating and immersive experience.",
      "tags": [
        "DAY",
        "PINK",
        "TWO SHOT",
        "EXTERIOR",
        "FLOATING",
        "RAINBOW"
      ],
      "technique_tags": [
        "Choreo",
        "Halation",
        "Levitation"
      ],
      "director": "Manish Khushalani",
      "dop": "",
      "colorist": "Vineesh Vijayan",
      "original_source": "",
      "additional_info": "Jhula - Manish Khushalani (2024)\nThe music video for \"Jhula\" by Manish Khushalani, released in 2024, explores themes of vulnerability, trust, and the delicate nature of relationships. The video combines Indian classical elements with contemporary electronic music, creating a unique visual and auditory experience. The narrative is driven by a series of intimate and evocative scenes that reflect the song's emotional depth, showcasing a blend of traditional and modern aesthetics that highlight the fusion of cultural influences. The visuals are crafted to complement the haunting melody and poignant lyrics, making for a captivating and immersive experience.\nTechnique - Choreo , Halation , Levitation\nDirector - Manish Khushalani\nEditor - Manish Khushalani\nColorist - Vineesh Vijayan\nOriginal Source - Link\nDAY\nPINK\nTWO SHOT\nEXTERIOR\nFLOATING\nRAINBOW",
      "page_url": "https://eyecannndy.com/technique/halation"
    },
    {
      "video_url": "https://asset.eyecannndy.com/media/clip/2024/09/12/261726174125.webp",
      "alt_text": "M.I.A. 'Bad Girls'",
      "discovered_at": "2025-09-12T06:32:30.887348",
      "title": "M.I.A. 'Bad Girls' (2012)",
      "description": "M.I.A.'s \"Bad Girls\" music video is a visually stunning showcase of Saudi-inspired car stunts, with drifting vehicles on two wheels and empowered women in a desert setting, blending Middle Eastern cultural elements with modern rebellion. Directed by Romain Gavras, the video highlights themes of female empowerment and defiance, all set against a backdrop of high-octane action and surreal imagery.",
      "tags": [
        "WOMAN",
        "EXTERIOR",
        "DESERT",
        "HAT",
        "MOROCCO"
      ],
      "technique_tags": [
        "Direct address",
        "Halation",
        "Single shot",
        "Slow Motion"
      ],
      "director": "Walter Mauriot",
      "dop": "André Chemetoff",
      "colorist": "",
      "original_source": "",
      "additional_info": "M.I.A. 'Bad Girls' (2012)\nM.I.A.'s \"Bad Girls\" music video is a visually stunning showcase of Saudi-inspired car stunts, with drifting vehicles on two wheels and empowered women in a desert setting, blending Middle Eastern cultural elements with modern rebellion. Directed by Romain Gavras, the video highlights themes of female empowerment and defiance, all set against a backdrop of high-octane action and surreal imagery.\nTechnique - Direct address , Halation , Single shot , Slow Motion\nDirector - Romain Gavras\nDOP - André Chemetoff\nEditor - Walter Mauriot\nOriginal Source - Link\nTutorial - Link\nWOMAN\nEXTERIOR\nDESERT\nHAT\nMOROCCO",
      "page_url": "https://eyecannndy.com/technique/halation"
    },
    {
      "video_url": "https://asset.eyecannndy.com/media/clip/2024/09/12/261726175012.webp",
      "alt_text": "M.I.A. 'Bad Girls'",
      "discovered_at": "2025-09-12T06:32:34.525880",
      "title": "M.I.A. 'Bad Girls' (2012)",
      "description": "M.I.A.'s \"Bad Girls\" music video is a visually stunning showcase of Saudi-inspired car stunts, with drifting vehicles on two wheels and empowered women in a desert setting, blending Middle Eastern cultural elements with modern rebellion. Directed by Romain Gavras, the video highlights themes of female empowerment and defiance, all set against a backdrop of high-octane action and surreal imagery.",
      "tags": [
        "MUSIC VIDEO",
        "GROUP",
        "DESERT",
        "SUN",
        "HALATION",
        "MOROCCO"
      ],
      "technique_tags": [
        "Halation",
        "Tracking"
      ],
      "director": "Walter Mauriot",
      "dop": "André Chemetoff",
      "colorist": "",
      "original_source": "",
      "additional_info": "M.I.A. 'Bad Girls' (2012)\nM.I.A.'s \"Bad Girls\" music video is a visually stunning showcase of Saudi-inspired car stunts, with drifting vehicles on two wheels and empowered women in a desert setting, blending Middle Eastern cultural elements with modern rebellion. Directed by Romain Gavras, the video highlights themes of female empowerment and defiance, all set against a backdrop of high-octane action and surreal imagery.\nTechnique - Halation , Tracking\nDirector - Romain Gavras\nDOP - André Chemetoff\nEditor - Walter Mauriot\nOriginal Source - Link\nTutorial - Link\nMUSIC VIDEO\nGROUP\nDESERT\nSUN\nHALATION\nMOROCCO",
      "page_url": "https://eyecannndy.com/technique/halation"
    },
    {
      "video_url": "https://asset.eyecannndy.com/media/clip/2024/03/12/261710224793.webp",
      "alt_text": "The Gentlemen (TV Series)",
      "discovered_at": "2025-09-12T06:32:38.171000",
      "title": "The Gentlemen (TV Series) (2024)",
      "description": "Season 1. Episode 4. Eddie Horniman inherits a family estate, initially unaware its home to a drug empire run by a syndicate that has no plans to vacate. Created by Guy Ritchie.",
      "tags": [
        "MALE",
        "INTERIOR",
        "CASTLE"
      ],
      "technique_tags": [
        "Halation"
      ],
      "director": "Dan Sherwen, Matt Platts-Mills",
      "dop": "Bjorn Charpentier",
      "colorist": "Matthieu Toullet",
      "original_source": "",
      "additional_info": "The Gentlemen (TV Series) (2024)\nSeason 1. Episode 4. Eddie Horniman inherits a family estate, initially unaware its home to a drug empire run by a syndicate that has no plans to vacate. Created by Guy Ritchie.\nTechnique - Halation\nDirector - Nima Nourizadeh\nDOP - Bjorn Charpentier\nEditor - Dan Sherwen, Matt Platts-Mills\nColorist - Matthieu Toullet\nMALE\nINTERIOR\nCASTLE",
      "page_url": "https://eyecannndy.com/technique/halation"
    },
    {
      "video_url": "https://asset.eyecannndy.com/media/clip/2024/02/20/261708423151.webp",
      "alt_text": "Seconds",
      "discovered_at": "2025-09-12T06:32:41.298054",
      "title": "Seconds (1966)",
      "description": "An unhappy middle-aged banker agrees to a procedure that will fake his death and give him a completely new look and identity - one that comes with its own price.",
      "tags": [
        "BLACK AND WHITE"
      ],
      "technique_tags": [
        "Halation"
      ],
      "director": "David Newhouse, Ferris Webster",
      "dop": "James Wong Howe",
      "colorist": "",
      "original_source": "",
      "additional_info": "Seconds (1966)\nAn unhappy middle-aged banker agrees to a procedure that will fake his death and give him a completely new look and identity - one that comes with its own price.\nTechnique - Halation\nDirector - John Frankenheimer\nDOP - James Wong Howe\nEditor - David Newhouse, Ferris Webster\nBLACK AND WHITE",
      "page_url": "https://eyecannndy.com/technique/halation"
    },
    {
      "video_url": "https://asset.eyecannndy.com/media/clip/2024/03/19/261710826036.webp",
      "alt_text": "Dillon Francis, Good Times Ahead - LA On Acid",
      "discovered_at": "2025-09-12T06:32:44.912002",
      "title": "Dillon Francis, Good Times Ahead - LA On Acid (2023)",
      "description": "Dillon Francis, Good Times Ahead - LA On Acid (2023)",
      "tags": [
        "WOMAN",
        "RESTAURANT",
        "INTERIOR",
        "WAITRESS"
      ],
      "technique_tags": [
        "Direct address",
        "Halation",
        "Low Angle"
      ],
      "director": "Jacob Ehrlich",
      "dop": "Franklin Ricart",
      "colorist": "Josh Bohoskey",
      "original_source": "",
      "additional_info": "Dillon Francis, Good Times Ahead - LA On Acid (2023)\nA mesmerizing music video featuring a chaotic journey initiated by Diplo's spiked chicken nugget, showcasing wild camera angles, unusual characters, and intense visual effects set in a quirky vintage Chinese restaurant. Director Seaman's close collaboration with Francis ensures a deep connection with the song's rhythms and lyrics, bringing to life a vividly demented world that captivates viewers, with or without the influence of LSD.\nTechnique - Direct address , Halation , Low Angle\nDirector - Parker Seaman\nDOP - Franklin Ricart\nEditor - Jacob Ehrlich\nColorist - Josh Bohoskey\nOriginal Source - Link\nWOMAN\nRESTAURANT\nINTERIOR\nWAITRESS",
      "page_url": "https://eyecannndy.com/technique/halation"
    },
    {
      "video_url": "https://asset.eyecannndy.com/media/clip/2024/01/29/261706500981.webp",
      "alt_text": "Uncut Gems",
      "discovered_at": "2025-09-12T06:32:48.557767",
      "title": "Uncut Gems (2019)",
      "description": "With his debts mounting and angry collectors closing in, a fast-talking New York City jeweler risks everything in hope of staying afloat and alive.",
      "tags": [
        "CAR",
        "NIGHT",
        "INTERIOR"
      ],
      "technique_tags": [
        "Close-Up",
        "Halation"
      ],
      "director": "Safdie Brothers",
      "dop": "",
      "colorist": "",
      "original_source": "",
      "additional_info": "Uncut Gems (2019)\nWith his debts mounting and angry collectors closing in, a fast-talking New York City jeweler risks everything in hope of staying afloat and alive.\nTechnique - Close-Up , Halation\nDirector - Safdie Brothers\nCAR\nNIGHT\nINTERIOR",
      "page_url": "https://eyecannndy.com/technique/halation"
    },
    {
      "video_url": "https://asset.eyecannndy.com/media/clip/2024/01/28/261706427577.webp",
      "alt_text": "The Shining",
      "discovered_at": "2025-09-12T06:32:52.198674",
      "title": "The Shining (1980)",
      "description": "A family heads to an isolated hotel for the winter where a sinister presence influences the father into violence, while his psychic son sees horrific forebodings from both past and future.",
      "tags": [
        "DRIVING",
        "DUSK",
        "DARK",
        "SNOW",
        "VEHICLE",
        "EVENING"
      ],
      "technique_tags": [
        "Halation",
        "Tracking"
      ],
      "director": "Ray Lovejoy",
      "dop": "John Alcott, Martin Kenzie",
      "colorist": "Eddie Gordon",
      "original_source": "",
      "additional_info": "The Shining (1980)\nA family heads to an isolated hotel for the winter where a sinister presence influences the father into violence, while his psychic son sees horrific forebodings from both past and future.\nTechnique - Halation , Tracking\nDirector - Stanley Kubrick\nDOP - John Alcott, Martin Kenzie\nEditor - Ray Lovejoy\nColorist - Eddie Gordon\nDRIVING\nDUSK\nDARK\nSNOW\nVEHICLE\nEVENING",
      "page_url": "https://eyecannndy.com/technique/halation"
    },
    {
      "video_url": "https://asset.eyecannndy.com/media/clip/2024/01/25/261706152122.webp",
      "alt_text": "Cat People",
      "discovered_at": "2025-09-12T06:32:55.815271",
      "title": "Cat People (1982)",
      "description": "A young woman's sexual awakening brings horror when she discovers her urges transform her into a monstrous black leopard.",
      "tags": [
        "LIGHT",
        "NIGHT",
        "BLUE",
        "HELICOPTER"
      ],
      "technique_tags": [
        "Halation"
      ],
      "director": "Jacqueline Cambas, Jere Huggins, Ned Humphreys",
      "dop": "John Bailey",
      "colorist": "",
      "original_source": "",
      "additional_info": "Cat People (1982)\nA young woman's sexual awakening brings horror when she discovers her urges transform her into a monstrous black leopard.\nTechnique - Halation\nDirector - Paul Schrader\nDOP - John Bailey\nEditor - Jacqueline Cambas, Jere Huggins, Ned Humphreys\nLIGHT\nNIGHT\nBLUE\nHELICOPTER",
      "page_url": "https://eyecannndy.com/technique/halation"
    },
    {
      "video_url": "https://asset.eyecannndy.com/media/clip/2024/03/09/261710023723.webp",
      "alt_text": "The Gentlemen (TV Series)",
      "discovered_at": "2025-09-12T06:32:59.429069",
      "title": "The Gentlemen (TV Series) (2024)",
      "description": "Eddie Horniman inherits a family estate, initially unaware its home to a drug empire run by a syndicate that has no plans to vacate. Created by Guy Ritchie.",
      "tags": [
        "INTERIOR",
        "HELICOPTER",
        "THEO JAMES",
        "CHOPPER"
      ],
      "technique_tags": [
        "Halation",
        "Handheld",
        "Pan"
      ],
      "director": "James Herbert",
      "dop": "Ed Wild",
      "colorist": "",
      "original_source": "",
      "additional_info": "The Gentlemen (TV Series) (2024)\nEddie Horniman inherits a family estate, initially unaware its home to a drug empire run by a syndicate that has no plans to vacate. Created by Guy Ritchie.\nTechnique - Halation , Handheld , Pan\nDirector - Guy Ritchie\nDOP - Ed Wild\nEditor - James Herbert\nINTERIOR\nHELICOPTER\nTHEO JAMES\nCHOPPER",
      "page_url": "https://eyecannndy.com/technique/halation"
    },
    {
      "video_url": "https://asset.eyecannndy.com/media/clip/2024/01/31/261706687518.webp",
      "alt_text": "Gregory Porter - Revival",
      "discovered_at": "2025-09-12T06:33:03.035433",
      "title": "Gregory Porter - Revival (2020)",
      "description": "Gregory Porter - Revival (2020)",
      "tags": [
        "NIGHT",
        "DUSK",
        "SUNSET",
        "DANCING",
        "BOY",
        "CHOREOGRAPHY"
      ],
      "technique_tags": [
        "Arc",
        "Halation",
        "Low Angle",
        "Silhouette",
        "X-Axis Arc"
      ],
      "director": "Danilo Abraham",
      "dop": "Chris Ripley",
      "colorist": "Osmar Junior",
      "original_source": "",
      "additional_info": "Gregory Porter - Revival (2020)\nAward-winning music video for artist Gregory Porter from director Douglas Bernardt. Sick use of scale shift technique. Produced by Stink Films.\nTechnique - Arc , Halation , Low Angle , Silhouette , X-Axis Arc\nDirector - Douglas Bernardt\nDOP - Chris Ripley\nEditor - Danilo Abraham\nColorist - Osmar Junior\nOriginal Source - Link\nNIGHT\nDUSK\nSUNSET\nDANCING\nBOY\nCHOREOGRAPHY",
      "page_url": "https://eyecannndy.com/technique/halation"
    },
    {
      "video_url": "https://asset.eyecannndy.com/media/clip/2024/03/26/261711434140.webp",
      "alt_text": "\"The Fear Cycle\" Film - Unveiling Sleep Paralysis Through Art",
      "discovered_at": "2025-09-12T06:33:06.633738",
      "title": "\"The Fear Cycle\" Film - Unveiling Sleep Paralysis Through Art (2024)",
      "description": "\"The Fear Cycle\" film explores Nicolas Bruno’s experiences with Sleep Paralysis, a sleep disorder that causes vivid nightmares. Bruno transforms his fears into artwork, giving viewers a glimpse into each dream sequence. This film delves into Bruno's creative journey, showcasing his artistic process, dream journal entries, and theatrical renditions of his visions.",
      "tags": [
        "DAY",
        "MALE",
        "EXTERIOR",
        "SUN",
        "RAYS"
      ],
      "technique_tags": [
        "Close-Up",
        "Halation"
      ],
      "director": "Armen Harootun",
      "dop": "",
      "colorist": "Connor Bailey",
      "original_source": "",
      "additional_info": "\"The Fear Cycle\" Film - Unveiling Sleep Paralysis Through Art (2024)\n\"The Fear Cycle\" film explores Nicolas Bruno’s experiences with Sleep Paralysis, a sleep disorder that causes vivid nightmares. Bruno transforms his fears into artwork, giving viewers a glimpse into each dream sequence. This film delves into Bruno's creative journey, showcasing his artistic process, dream journal entries, and theatrical renditions of his visions.\nTechnique - Close-Up , Halation\nDirector - Dexter Brierley, Matthew Seger\nEditor - Armen Harootun\nColorist - Connor Bailey\nOriginal Source - Link\nDAY\nMALE\nEXTERIOR\nSUN\nRAYS",
      "page_url": "https://eyecannndy.com/technique/halation"
    },
    {
      "video_url": "https://asset.eyecannndy.com/media/clip/2024/05/09/261715291889.webp",
      "alt_text": "Inter Alia (Short Film)",
      "discovered_at": "2025-09-12T06:33:09.725002",
      "title": "Inter Alia (Short Film) (2023)",
      "description": "A musician is given everything. Money, fame, & more...but sometimes our dreams are just nightmares. After you arrive to your success, what comes next? Can you still find who you are after losing yourself? Is any of this even real?",
      "tags": [
        "CAR",
        "DRIVING",
        "DUSK",
        "SUNSET",
        "EXTERIOR",
        "LOS ANGELES",
        "VEHICLE"
      ],
      "technique_tags": [
        "Halation"
      ],
      "director": "Daniel Lawrence Wilson",
      "dop": "Michael Fenton",
      "colorist": "",
      "original_source": "",
      "additional_info": "Inter Alia (Short Film) (2023)\nA musician is given everything. Money, fame, & more...but sometimes our dreams are just nightmares. After you arrive to your success, what comes next? Can you still find who you are after losing yourself? Is any of this even real?\nTechnique - Halation\nDirector - Daniel Lawrence Wilson\nDOP - Michael Fenton\nOriginal Source - Link\nCAR\nDRIVING\nDUSK\nSUNSET\nEXTERIOR\nLOS ANGELES\nVEHICLE",
      "page_url": "https://eyecannndy.com/technique/halation"
    },
    {
      "video_url": "https://asset.eyecannndy.com/media/clip/2024/03/04/261709545647.webp",
      "alt_text": "Riot & Set it off",
      "discovered_at": "2025-09-12T06:33:13.407628",
      "title": "Riot & Set it off (2024)",
      "description": "2024 music video directed by Trey Lyons. Features beautiful slow motion sequences and frenetic sequences.",
      "tags": [
        "NIGHT",
        "DUSK",
        "EXTERIOR",
        "SOLDIER"
      ],
      "technique_tags": [
        "Halation",
        "Silhouette"
      ],
      "director": "Alex Morrison",
      "dop": "Franklin Ricart",
      "colorist": "Company 3, Joseph Bicknell",
      "original_source": "",
      "additional_info": "Riot & Set it off (2024)\n2024 music video directed by Trey Lyons. Features beautiful slow motion sequences and frenetic sequences.\nTechnique - Halation , Silhouette\nDirector - Trey Lyons\nDOP - Franklin Ricart\nEditor - Alex Morrison\nColorist - Company 3, Joseph Bicknell\nOriginal Source - Link\nNIGHT\nDUSK\nEXTERIOR\nSOLDIER",
      "page_url": "https://eyecannndy.com/technique/halation"
    },
    {
      "video_url": "https://asset.eyecannndy.com/media/clip/2024/05/14/261715645079.webp",
      "alt_text": "Oblé Reed - WESTON.",
      "discovered_at": "2025-09-12T06:33:16.549984",
      "title": "Oblé Reed - WESTON. (2023)",
      "description": "Oblé Reed - WESTON. (2023)\nMusic video\nTechnique - Halation , Silhouette\nDirector - Nash Pearson\nEditor - Nash Pearson\nOriginal Source - Link\nLIGHT\nWOMAN\nSILHOUETTE\nHAIR",
      "tags": [
        "LIGHT",
        "WOMAN",
        "SILHOUETTE",
        "HAIR"
      ],
      "technique_tags": [
        "Halation",
        "Silhouette"
      ],
      "director": "Nash Pearson",
      "dop": "",
      "colorist": "",
      "original_source": "",
      "additional_info": "Oblé Reed - WESTON. (2023)\nMusic video\nTechnique - Halation , Silhouette\nDirector - Nash Pearson\nEditor - Nash Pearson\nOriginal Source - Link\nLIGHT\nWOMAN\nSILHOUETTE\nHAIR",
      "page_url": "https://eyecannndy.com/technique/halation"
    },
    {
      "video_url": "https://asset.eyecannndy.com/media/clip/2024/02/20/261708421922.webp",
      "alt_text": "Mean Streets",
      "discovered_at": "2025-09-12T06:33:20.153950",
      "title": "Mean Streets (1973)",
      "description": "In New York City's Little Italy, a devoutly Catholic mobster must reconcile his desire for power, his feelings for his epileptic lover, and his devotion to his troublesome friend.",
      "tags": [
        "DAY",
        "SUNSET",
        "EXTERIOR",
        "TRUCK",
        "GOLDEN HOUR"
      ],
      "technique_tags": [
        "Halation"
      ],
      "director": "Sidney Levin",
      "dop": "Kent L. Wakeford",
      "colorist": "",
      "original_source": "",
      "additional_info": "Mean Streets (1973)\nIn New York City's Little Italy, a devoutly Catholic mobster must reconcile his desire for power, his feelings for his epileptic lover, and his devotion to his troublesome friend.\nTechnique - Halation\nDirector - Martin Scorsese\nDOP - Kent L. Wakeford\nEditor - Sidney Levin\nDAY\nSUNSET\nEXTERIOR\nTRUCK\nGOLDEN HOUR",
      "page_url": "https://eyecannndy.com/technique/halation"
    },
    {
      "video_url": "https://asset.eyecannndy.com/media/clip/2024/09/12/261726175258.webp",
      "alt_text": "M.I.A. 'Bad Girls'",
      "discovered_at": "2025-09-12T06:33:23.237654",
      "title": "M.I.A. 'Bad Girls' (2012)",
      "description": "M.I.A.'s \"Bad Girls\" music video is a visually stunning showcase of Saudi-inspired car stunts, with drifting vehicles on two wheels and empowered women in a desert setting, blending Middle Eastern cultural elements with modern rebellion. Directed by Romain Gavras, the video highlights themes of female empowerment and defiance, all set against a backdrop of high-octane action and surreal imagery.",
      "tags": [
        "WOMAN",
        "CLOSE UP",
        "MUSIC VIDEO",
        "DESERT",
        "MOROCCO"
      ],
      "technique_tags": [
        "Close-Up",
        "Direct",
        "Halation"
      ],
      "director": "Walter Mauriot",
      "dop": "André Chemetoff",
      "colorist": "",
      "original_source": "",
      "additional_info": "M.I.A. 'Bad Girls' (2012)\nM.I.A.'s \"Bad Girls\" music video is a visually stunning showcase of Saudi-inspired car stunts, with drifting vehicles on two wheels and empowered women in a desert setting, blending Middle Eastern cultural elements with modern rebellion. Directed by Romain Gavras, the video highlights themes of female empowerment and defiance, all set against a backdrop of high-octane action and surreal imagery.\nTechnique - Close-Up , Direct , Halation\nDirector - Romain Gavras\nDOP - André Chemetoff\nEditor - Walter Mauriot\nOriginal Source - Link\nTutorial - Link\nWOMAN\nCLOSE UP\nMUSIC VIDEO\nDESERT\nMOROCCO",
      "page_url": "https://eyecannndy.com/technique/halation"
    },
    {
      "video_url": "https://asset.eyecannndy.com/media/clip/2024/03/12/261710224697.webp",
      "alt_text": "The Gentlemen (TV Series)",
      "discovered_at": "2025-09-12T06:33:26.365573",
      "title": "The Gentlemen (TV Series) (2024)",
      "description": "Season 1. Episode 4. Eddie Horniman inherits a family estate, initially unaware its home to a drug empire run by a syndicate that has no plans to vacate. Created by Guy Ritchie.",
      "tags": [
        "INTERIOR",
        "CASTLE",
        "JAR",
        "GLASS JAR"
      ],
      "technique_tags": [
        "Halation",
        "Projections"
      ],
      "director": "Dan Sherwen, Matt Platts-Mills",
      "dop": "Bjorn Charpentier",
      "colorist": "Matthieu Toullet",
      "original_source": "",
      "additional_info": "The Gentlemen (TV Series) (2024)\nSeason 1. Episode 4. Eddie Horniman inherits a family estate, initially unaware its home to a drug empire run by a syndicate that has no plans to vacate. Created by Guy Ritchie.\nTechnique - Halation , Projections\nDirector - Nima Nourizadeh\nDOP - Bjorn Charpentier\nEditor - Dan Sherwen, Matt Platts-Mills\nColorist - Matthieu Toullet\nINTERIOR\nCASTLE\nJAR\nGLASS JAR",
      "page_url": "https://eyecannndy.com/technique/halation"
    }
  ]
}