{
  "technique": "haze",
  "scrape_info": {
    "timestamp": "20250911_145834",
    "total_videos": 18,
    "scraper_type": "comprehensive_popup_modal"
  },
  "videos": [
    {
      "video_url": "https://asset.eyecannndy.com/media/clip/2024/09/12/261726175115.webp",
      "alt_text": "M.I.A. 'Bad Girls'",
      "discovered_at": "2025-09-11T14:57:18.631398",
      "title": "M.I.A. 'Bad Girls' (2012)",
      "description": "M.I.A.'s \"Bad Girls\" music video is a visually stunning showcase of Saudi-inspired car stunts, with drifting vehicles on two wheels and empowered women in a desert setting, blending Middle Eastern cultural elements with modern rebellion. Directed by Romain Gavras, the video highlights themes of female empowerment and defiance, all set against a backdrop of high-octane action and surreal imagery.",
      "tags": [
        "CAR",
        "MUSIC VIDEO",
        "GROUP",
        "ROOF",
        "DESERT",
        "DUST",
        "MOROCCO"
      ],
      "technique_tags": [
        "Haze"
      ],
      "director": "Walter Mauriot",
      "dop": "André Chemetoff",
      "colorist": "",
      "original_source": "",
      "additional_info": "M.I.A. 'Bad Girls' (2012)\nM.I.A.'s \"Bad Girls\" music video is a visually stunning showcase of Saudi-inspired car stunts, with drifting vehicles on two wheels and empowered women in a desert setting, blending Middle Eastern cultural elements with modern rebellion. Directed by Romain Gavras, the video highlights themes of female empowerment and defiance, all set against a backdrop of high-octane action and surreal imagery.\nTechnique - Haze\nDirector - Romain Gavras\nDOP - André Chemetoff\nEditor - Walter Mauriot\nOriginal Source - Link\nTutorial - Link\nCAR\nMUSIC VIDEO\nGROUP\nROOF\nDESERT\nDUST\nMOROCCO",
      "page_url": "https://eyecannndy.com/technique/haze"
    },
    {
      "video_url": "https://asset.eyecannndy.com/media/clip/2024/09/12/261726174762.webp",
      "alt_text": "M.I.A. 'Bad Girls'",
      "discovered_at": "2025-09-11T14:57:22.811757",
      "title": "M.I.A. 'Bad Girls' (2012)",
      "description": "M.I.A.'s \"Bad Girls\" music video is a visually stunning showcase of Saudi-inspired car stunts, with drifting vehicles on two wheels and empowered women in a desert setting, blending Middle Eastern cultural elements with modern rebellion. Directed by Romain Gavras, the video highlights themes of female empowerment and defiance, all set against a backdrop of high-octane action and surreal imagery.",
      "tags": [
        "DAY",
        "RACING",
        "SMOKE",
        "DESERT",
        "CARS",
        "DUST",
        "MOROCCO"
      ],
      "technique_tags": [
        "Action",
        "Haze"
      ],
      "director": "Walter Mauriot",
      "dop": "André Chemetoff",
      "colorist": "",
      "original_source": "",
      "additional_info": "M.I.A. 'Bad Girls' (2012)\nM.I.A.'s \"Bad Girls\" music video is a visually stunning showcase of Saudi-inspired car stunts, with drifting vehicles on two wheels and empowered women in a desert setting, blending Middle Eastern cultural elements with modern rebellion. Directed by Romain Gavras, the video highlights themes of female empowerment and defiance, all set against a backdrop of high-octane action and surreal imagery.\nTechnique - Action , Haze\nDirector - Romain Gavras\nDOP - André Chemetoff\nEditor - Walter Mauriot\nOriginal Source - Link\nTutorial - Link\nDAY\nRACING\nSMOKE\nDESERT\nCARS\nDUST\nMOROCCO",
      "page_url": "https://eyecannndy.com/technique/haze"
    },
    {
      "video_url": "https://asset.eyecannndy.com/media/clip/2024/05/13/261715642075.webp",
      "alt_text": "Vince Staples - Norf Norf",
      "discovered_at": "2025-09-11T14:57:26.474442",
      "title": "Vince Staples - Norf Norf (2015)",
      "description": "The music video for \"Norf Norf\" by Vince Staples, released in 2015, features documentary-style footage that portrays the harsh realities of life in North Long Beach, California. Through scenes of Vince in a police car and visuals of his neighborhood, the video underscores the song's themes of systemic injustice and police brutality.",
      "tags": [
        "INTERIOR",
        "BLACK AND WHITE",
        "POLICE",
        "COPS",
        "JAIL",
        "ARRESTED",
        "PRISON",
        "VINCE STAPLES",
        "INTERROGATION",
        "POLICE OFFICERS"
      ],
      "technique_tags": [
        "Haze"
      ],
      "director": "Spike Jordan, Vince Staples",
      "dop": "",
      "colorist": "",
      "original_source": "",
      "additional_info": "Vince Staples - Norf Norf (2015)\nThe music video for \"Norf Norf\" by Vince Staples, released in 2015, features documentary-style footage that portrays the harsh realities of life in North Long Beach, California. Through scenes of Vince in a police car and visuals of his neighborhood, the video underscores the song's themes of systemic injustice and police brutality.\nTechnique - Haze\nDirector - Spike Jordan, Vince Staples\nOriginal Source - Link\nINTERIOR\nBLACK AND WHITE\nPOLICE\nCOPS\nJAIL\nARRESTED\nPRISON\nVINCE STAPLES\nINTERROGATION\nPOLICE OFFICERS",
      "page_url": "https://eyecannndy.com/technique/haze"
    },
    {
      "video_url": "https://asset.eyecannndy.com/media/clip/2024/09/12/261726175171.webp",
      "alt_text": "M.I.A. 'Bad Girls'",
      "discovered_at": "2025-09-11T14:57:31.713661",
      "title": "M.I.A. 'Bad Girls' (2012)",
      "description": "M.I.A.'s \"Bad Girls\" music video is a visually stunning showcase of Saudi-inspired car stunts, with drifting vehicles on two wheels and empowered women in a desert setting, blending Middle Eastern cultural elements with modern rebellion. Directed by Romain Gavras, the video highlights themes of female empowerment and defiance, all set against a backdrop of high-octane action and surreal imagery.",
      "tags": [
        "CAR",
        "MUSIC VIDEO",
        "ROOF",
        "DESERT",
        "DUST",
        "MOROCCO",
        "STUNT"
      ],
      "technique_tags": [
        "Away from Camera",
        "Haze",
        "Slow Motion",
        "Tracking"
      ],
      "director": "Walter Mauriot",
      "dop": "André Chemetoff",
      "colorist": "",
      "original_source": "",
      "additional_info": "M.I.A. 'Bad Girls' (2012)\nM.I.A.'s \"Bad Girls\" music video is a visually stunning showcase of Saudi-inspired car stunts, with drifting vehicles on two wheels and empowered women in a desert setting, blending Middle Eastern cultural elements with modern rebellion. Directed by Romain Gavras, the video highlights themes of female empowerment and defiance, all set against a backdrop of high-octane action and surreal imagery.\nTechnique - Away from Camera , Haze , Slow Motion , Tracking\nDirector - Romain Gavras\nDOP - André Chemetoff\nEditor - Walter Mauriot\nOriginal Source - Link\nTutorial - Link\nCAR\nMUSIC VIDEO\nROOF\nDESERT\nDUST\nMOROCCO\nSTUNT",
      "page_url": "https://eyecannndy.com/technique/haze"
    },
    {
      "video_url": "https://asset.eyecannndy.com/media/clip/2024/05/15/261715812726.webp",
      "alt_text": "Sabrina Carpenter - Espresso",
      "discovered_at": "2025-09-11T14:57:35.917645",
      "title": "Sabrina Carpenter - Espresso (2024)",
      "description": "The music video for Sabrina Carpenter's song \"Espresso,\" released in 2024, was directed by Dave Meyers. The video features vibrant and sun-soaked visuals, showcasing Carpenter in various stylish outfits as she navigates a dreamy, retro-inspired setting. With a playful and energetic vibe, the video highlights Carpenter's charisma and the song's catchy, upbeat nature. The creative direction was managed by Jacobi Mehringer and Anna Arnell, adding to the video's polished and dynamic aesthetic.",
      "tags": [
        "BEACH",
        "SAND",
        "WALKING",
        "POSE",
        "SABRINA CARPENTER",
        "MARILYN MONROE"
      ],
      "technique_tags": [
        "1960s",
        "Haze"
      ],
      "director": "Jai Shukla",
      "dop": "Scott Cunningham",
      "colorist": "Dante Pasquinelli",
      "original_source": "",
      "additional_info": "Sabrina Carpenter - Espresso (2024)\nThe music video for Sabrina Carpenter's song \"Espresso,\" released in 2024, was directed by Dave Meyers. The video features vibrant and sun-soaked visuals, showcasing Carpenter in various stylish outfits as she navigates a dreamy, retro-inspired setting. With a playful and energetic vibe, the video highlights Carpenter's charisma and the song's catchy, upbeat nature. The creative direction was managed by Jacobi Mehringer and Anna Arnell, adding to the video's polished and dynamic aesthetic.\nTechnique - 1960s , Haze\nDirector - Dave Meyers\nDOP - Scott Cunningham\nEditor - Jai Shukla\nColorist - Dante Pasquinelli\nOriginal Source - Link\nBEACH\nSAND\nWALKING\nPOSE\nSABRINA CARPENTER\nMARILYN MONROE",
      "page_url": "https://eyecannndy.com/technique/haze"
    },
    {
      "video_url": "https://asset.eyecannndy.com/media/clip/2024/05/13/261715642188.webp",
      "alt_text": "Vince Staples - Norf Norf",
      "discovered_at": "2025-09-11T14:57:41.694948",
      "title": "Vince Staples - Norf Norf (2015)",
      "description": "The music video for \"Norf Norf\" by Vince Staples, released in 2015, features documentary-style footage that portrays the harsh realities of life in North Long Beach, California. Through scenes of Vince in a police car and visuals of his neighborhood, the video underscores the song's themes of systemic injustice and police brutality.",
      "tags": [
        "INTERIOR",
        "BLACK AND WHITE",
        "POLICE",
        "COPS",
        "JAIL",
        "ARRESTED",
        "PRISON",
        "VINCE STAPLES",
        "INTERROGATION",
        "POLICE OFFICERS"
      ],
      "technique_tags": [
        "Haze"
      ],
      "director": "Spike Jordan, Vince Staples",
      "dop": "",
      "colorist": "",
      "original_source": "",
      "additional_info": "Vince Staples - Norf Norf (2015)\nThe music video for \"Norf Norf\" by Vince Staples, released in 2015, features documentary-style footage that portrays the harsh realities of life in North Long Beach, California. Through scenes of Vince in a police car and visuals of his neighborhood, the video underscores the song's themes of systemic injustice and police brutality.\nTechnique - Haze\nDirector - Spike Jordan, Vince Staples\nOriginal Source - Link\nINTERIOR\nBLACK AND WHITE\nPOLICE\nCOPS\nJAIL\nARRESTED\nPRISON\nVINCE STAPLES\nINTERROGATION\nPOLICE OFFICERS",
      "page_url": "https://eyecannndy.com/technique/haze"
    },
    {
      "video_url": "https://asset.eyecannndy.com/media/clip/2024/09/12/261726174805.webp",
      "alt_text": "M.I.A. 'Bad Girls'",
      "discovered_at": "2025-09-11T14:57:45.856387",
      "title": "M.I.A. 'Bad Girls' (2012)",
      "description": "M.I.A.'s \"Bad Girls\" music video is a visually stunning showcase of Saudi-inspired car stunts, with drifting vehicles on two wheels and empowered women in a desert setting, blending Middle Eastern cultural elements with modern rebellion. Directed by Romain Gavras, the video highlights themes of female empowerment and defiance, all set against a backdrop of high-octane action and surreal imagery.",
      "tags": [
        "DAY",
        "RED",
        "RACING",
        "SMOKE",
        "DESERT",
        "CARS",
        "DRIFTING",
        "DUST",
        "MOROCCO"
      ],
      "technique_tags": [
        "Action",
        "Haze",
        "Slow Motion",
        "Tracking"
      ],
      "director": "Walter Mauriot",
      "dop": "André Chemetoff",
      "colorist": "",
      "original_source": "",
      "additional_info": "M.I.A. 'Bad Girls' (2012)\nM.I.A.'s \"Bad Girls\" music video is a visually stunning showcase of Saudi-inspired car stunts, with drifting vehicles on two wheels and empowered women in a desert setting, blending Middle Eastern cultural elements with modern rebellion. Directed by Romain Gavras, the video highlights themes of female empowerment and defiance, all set against a backdrop of high-octane action and surreal imagery.\nTechnique - Action , Haze , Slow Motion , Tracking\nDirector - Romain Gavras\nDOP - André Chemetoff\nEditor - Walter Mauriot\nOriginal Source - Link\nTutorial - Link\nDAY\nRED\nRACING\nSMOKE\nDESERT\nCARS\nDRIFTING\nDUST\nMOROCCO",
      "page_url": "https://eyecannndy.com/technique/haze"
    },
    {
      "video_url": "https://asset.eyecannndy.com/media/clip/2024/05/13/261715644650.webp",
      "alt_text": "Oblé Reed - WESTON.",
      "discovered_at": "2025-09-11T14:57:49.482391",
      "title": "Oblé Reed - WESTON. (2023)",
      "description": "",
      "tags": [
        "MALE",
        "ROAD",
        "NIGHT",
        "EXTERIOR"
      ],
      "technique_tags": [
        "Haze",
        "Omnidirectional",
        "Spotlight",
        "Ultra Wide"
      ],
      "director": "Nash Pearson",
      "dop": "",
      "colorist": "",
      "original_source": "",
      "additional_info": "Oblé Reed - WESTON. (2023)\nMusic video\nTechnique - Haze , Omnidirectional , Spotlight , Ultra Wide\nDirector - Nash Pearson\nEditor - Nash Pearson\nOriginal Source - Link\nMALE\nROAD\nNIGHT\nEXTERIOR",
      "page_url": "https://eyecannndy.com/technique/haze"
    },
    {
      "video_url": "https://asset.eyecannndy.com/media/clip/2024/05/13/261715642026.webp",
      "alt_text": "Vince Staples - Norf Norf",
      "discovered_at": "2025-09-11T14:57:53.648692",
      "title": "Vince Staples - Norf Norf (2015)",
      "description": "The music video for \"Norf Norf\" by Vince Staples, released in 2015, features documentary-style footage that portrays the harsh realities of life in North Long Beach, California. Through scenes of Vince in a police car and visuals of his neighborhood, the video underscores the song's themes of systemic injustice and police brutality.",
      "tags": [
        "INTERIOR",
        "BLACK AND WHITE",
        "POLICE",
        "COPS",
        "JAIL",
        "ARRESTED",
        "PRISON",
        "VINCE STAPLES",
        "INTERROGATION",
        "POLICE OFFICERS"
      ],
      "technique_tags": [
        "Haze"
      ],
      "director": "Spike Jordan, Vince Staples",
      "dop": "",
      "colorist": "",
      "original_source": "",
      "additional_info": "Vince Staples - Norf Norf (2015)\nThe music video for \"Norf Norf\" by Vince Staples, released in 2015, features documentary-style footage that portrays the harsh realities of life in North Long Beach, California. Through scenes of Vince in a police car and visuals of his neighborhood, the video underscores the song's themes of systemic injustice and police brutality.\nTechnique - Haze\nDirector - Spike Jordan, Vince Staples\nOriginal Source - Link\nINTERIOR\nBLACK AND WHITE\nPOLICE\nCOPS\nJAIL\nARRESTED\nPRISON\nVINCE STAPLES\nINTERROGATION\nPOLICE OFFICERS",
      "page_url": "https://eyecannndy.com/technique/haze"
    },
    {
      "video_url": "https://asset.eyecannndy.com/media/clip/2024/05/13/261715642104.webp",
      "alt_text": "Vince Staples - Norf Norf",
      "discovered_at": "2025-09-11T14:57:57.289877",
      "title": "Vince Staples - Norf Norf (2015)",
      "description": "The music video for \"Norf Norf\" by Vince Staples, released in 2015, features documentary-style footage that portrays the harsh realities of life in North Long Beach, California. Through scenes of Vince in a police car and visuals of his neighborhood, the video underscores the song's themes of systemic injustice and police brutality.",
      "tags": [
        "INTERIOR",
        "BLACK AND WHITE",
        "POLICE",
        "COPS",
        "JAIL",
        "ARRESTED",
        "PRISON",
        "VINCE STAPLES",
        "INTERROGATION",
        "POLICE OFFICERS"
      ],
      "technique_tags": [
        "Haze"
      ],
      "director": "Spike Jordan, Vince Staples",
      "dop": "",
      "colorist": "",
      "original_source": "",
      "additional_info": "Vince Staples - Norf Norf (2015)\nThe music video for \"Norf Norf\" by Vince Staples, released in 2015, features documentary-style footage that portrays the harsh realities of life in North Long Beach, California. Through scenes of Vince in a police car and visuals of his neighborhood, the video underscores the song's themes of systemic injustice and police brutality.\nTechnique - Haze\nDirector - Spike Jordan, Vince Staples\nOriginal Source - Link\nINTERIOR\nBLACK AND WHITE\nPOLICE\nCOPS\nJAIL\nARRESTED\nPRISON\nVINCE STAPLES\nINTERROGATION\nPOLICE OFFICERS",
      "page_url": "https://eyecannndy.com/technique/haze"
    },
    {
      "video_url": "https://asset.eyecannndy.com/media/clip/2024/05/15/261715812813.webp",
      "alt_text": "Sabrina Carpenter - Espresso",
      "discovered_at": "2025-09-11T14:58:01.497112",
      "title": "Sabrina Carpenter - Espresso (2024)",
      "description": "The music video for Sabrina Carpenter's song \"Espresso,\" released in 2024, was directed by Dave Meyers. The video features vibrant and sun-soaked visuals, showcasing Carpenter in various stylish outfits as she navigates a dreamy, retro-inspired setting. With a playful and energetic vibe, the video highlights Carpenter's charisma and the song's catchy, upbeat nature. The creative direction was managed by Jacobi Mehringer and Anna Arnell, adding to the video's polished and dynamic aesthetic.",
      "tags": [
        "BEACH",
        "SAND",
        "WALKING",
        "POSE",
        "SABRINA CARPENTER",
        "MARILYN MONROE"
      ],
      "technique_tags": [
        "1960s",
        "Freeze Frame",
        "Haze",
        "Photography"
      ],
      "director": "Jai Shukla",
      "dop": "Scott Cunningham",
      "colorist": "Dante Pasquinelli",
      "original_source": "",
      "additional_info": "Sabrina Carpenter - Espresso (2024)\nThe music video for Sabrina Carpenter's song \"Espresso,\" released in 2024, was directed by Dave Meyers. The video features vibrant and sun-soaked visuals, showcasing Carpenter in various stylish outfits as she navigates a dreamy, retro-inspired setting. With a playful and energetic vibe, the video highlights Carpenter's charisma and the song's catchy, upbeat nature. The creative direction was managed by Jacobi Mehringer and Anna Arnell, adding to the video's polished and dynamic aesthetic.\nTechnique - 1960s , Freeze Frame , Haze , Photography\nDirector - Dave Meyers\nDOP - Scott Cunningham\nEditor - Jai Shukla\nColorist - Dante Pasquinelli\nOriginal Source - Link\nBEACH\nSAND\nWALKING\nPOSE\nSABRINA CARPENTER\nMARILYN MONROE",
      "page_url": "https://eyecannndy.com/technique/haze"
    },
    {
      "video_url": "https://asset.eyecannndy.com/media/clip/2024/05/21/261716271837.webp",
      "alt_text": "Dune: Part Two",
      "discovered_at": "2025-09-11T14:58:06.196438",
      "title": "Dune: Part Two (2024)",
      "description": "Paul Atreides unites with Chani and the Fremen while seeking revenge against the conspirators who destroyed his family.",
      "tags": [
        "TIMOTHEE CHALAMET"
      ],
      "technique_tags": [
        "Haze",
        "Wide shot"
      ],
      "director": "Joe Walker",
      "dop": "Greig Fraser",
      "colorist": "Dave Cole",
      "original_source": "",
      "additional_info": "Dune: Part Two (2024)\nPaul Atreides unites with Chani and the Fremen while seeking revenge against the conspirators who destroyed his family.\nTechnique - Haze , Wide shot\nDirector - Denis Villeneuve\nDOP - Greig Fraser\nEditor - Joe Walker\nColorist - Dave Cole\nTIMOTHEE CHALAMET",
      "page_url": "https://eyecannndy.com/technique/haze"
    },
    {
      "video_url": "https://asset.eyecannndy.com/media/clip/2024/07/05/261720165328.webp",
      "alt_text": "Victoria Monet - Alright",
      "discovered_at": "2025-09-11T14:58:12.480296",
      "title": "Victoria Monet - Alright (2024)",
      "description": "The music video for \"Alright\" by Victoria Monét, directed by Dave Meyers, is a vibrant homage to Janet Jackson, featuring high-energy choreography and striking visuals. In the video, Monét channels Jackson's iconic style, wearing a black-and-white fedora and suit, and performing dynamic dance routines reminiscent of Jackson's 1990s and 2000s era. The video, choreographed by Sean Bankhead, showcases Monét's impressive dance skills and captures the essence of liberation and celebration. Made in collaboration with Jacobi Mehringer, Anna Arnell, and Mia Barnes.",
      "tags": [
        "BLUE",
        "VICTORIA MONET",
        "GLITTER"
      ],
      "technique_tags": [
        "Choreo",
        "Haze"
      ],
      "director": "Vinnie Hobbs",
      "dop": "Scott Cunningham",
      "colorist": "Dante Pasquinelli",
      "original_source": "",
      "additional_info": "Victoria Monet - Alright (2024)\nThe music video for \"Alright\" by Victoria Monét, directed by Dave Meyers, is a vibrant homage to Janet Jackson, featuring high-energy choreography and striking visuals. In the video, Monét channels Jackson's iconic style, wearing a black-and-white fedora and suit, and performing dynamic dance routines reminiscent of Jackson's 1990s and 2000s era. The video, choreographed by Sean Bankhead, showcases Monét's impressive dance skills and captures the essence of liberation and celebration. Made in collaboration with Jacobi Mehringer, Anna Arnell, and Mia Barnes.\nTechnique - Choreo , Haze\nDirector - Dave Meyers\nDOP - Scott Cunningham\nEditor - Vinnie Hobbs\nColorist - Dante Pasquinelli\nOriginal Source - Link\nBLUE\nVICTORIA MONET\nGLITTER",
      "page_url": "https://eyecannndy.com/technique/haze"
    },
    {
      "video_url": "https://asset.eyecannndy.com/media/clip/2024/05/13/261715641988.webp",
      "alt_text": "Vince Staples - Norf Norf",
      "discovered_at": "2025-09-11T14:58:16.676122",
      "title": "Vince Staples - Norf Norf (2015)",
      "description": "The music video for \"Norf Norf\" by Vince Staples, released in 2015, features documentary-style footage that portrays the harsh realities of life in North Long Beach, California. Through scenes of Vince in a police car and visuals of his neighborhood, the video underscores the song's themes of systemic injustice and police brutality.",
      "tags": [
        "INTERIOR",
        "BLACK AND WHITE",
        "POLICE",
        "COPS",
        "JAIL",
        "ARRESTED",
        "PRISON",
        "VINCE STAPLES",
        "INTERROGATION",
        "POLICE OFFICERS"
      ],
      "technique_tags": [
        "Haze",
        "Quick Cuts"
      ],
      "director": "Spike Jordan, Vince Staples",
      "dop": "",
      "colorist": "",
      "original_source": "",
      "additional_info": "Vince Staples - Norf Norf (2015)\nThe music video for \"Norf Norf\" by Vince Staples, released in 2015, features documentary-style footage that portrays the harsh realities of life in North Long Beach, California. Through scenes of Vince in a police car and visuals of his neighborhood, the video underscores the song's themes of systemic injustice and police brutality.\nTechnique - Haze , Quick Cuts\nDirector - Spike Jordan, Vince Staples\nOriginal Source - Link\nINTERIOR\nBLACK AND WHITE\nPOLICE\nCOPS\nJAIL\nARRESTED\nPRISON\nVINCE STAPLES\nINTERROGATION\nPOLICE OFFICERS",
      "page_url": "https://eyecannndy.com/technique/haze"
    },
    {
      "video_url": "https://asset.eyecannndy.com/media/clip/2024/05/13/261715643687.webp",
      "alt_text": "Oblé Reed - WESTON.",
      "discovered_at": "2025-09-11T14:58:22.977317",
      "title": "Oblé Reed - WESTON. (2023)",
      "description": "",
      "tags": [
        "MALE",
        "NIGHT",
        "EXTERIOR"
      ],
      "technique_tags": [
        "Handheld",
        "Haze"
      ],
      "director": "Nash Pearson",
      "dop": "",
      "colorist": "",
      "original_source": "",
      "additional_info": "Oblé Reed - WESTON. (2023)\nMusic video\nTechnique - Handheld , Haze\nDirector - Nash Pearson\nEditor - Nash Pearson\nOriginal Source - Link\nMALE\nNIGHT\nEXTERIOR",
      "page_url": "https://eyecannndy.com/technique/haze"
    },
    {
      "video_url": "https://asset.eyecannndy.com/media/clip/2024/05/15/261715812773.webp",
      "alt_text": "Sabrina Carpenter - Espresso",
      "discovered_at": "2025-09-11T14:58:26.615350",
      "title": "Sabrina Carpenter - Espresso (2024)",
      "description": "The music video for Sabrina Carpenter's song \"Espresso,\" released in 2024, was directed by Dave Meyers. The video features vibrant and sun-soaked visuals, showcasing Carpenter in various stylish outfits as she navigates a dreamy, retro-inspired setting. With a playful and energetic vibe, the video highlights Carpenter's charisma and the song's catchy, upbeat nature. The creative direction was managed by Jacobi Mehringer and Anna Arnell, adding to the video's polished and dynamic aesthetic.",
      "tags": [
        "BEACH",
        "SAND",
        "WALKING",
        "POSE",
        "SABRINA CARPENTER",
        "MARILYN MONROE"
      ],
      "technique_tags": [
        "1960s",
        "Freeze Frame",
        "Haze",
        "Photography"
      ],
      "director": "Jai Shukla",
      "dop": "Scott Cunningham",
      "colorist": "Dante Pasquinelli",
      "original_source": "",
      "additional_info": "Sabrina Carpenter - Espresso (2024)\nThe music video for Sabrina Carpenter's song \"Espresso,\" released in 2024, was directed by Dave Meyers. The video features vibrant and sun-soaked visuals, showcasing Carpenter in various stylish outfits as she navigates a dreamy, retro-inspired setting. With a playful and energetic vibe, the video highlights Carpenter's charisma and the song's catchy, upbeat nature. The creative direction was managed by Jacobi Mehringer and Anna Arnell, adding to the video's polished and dynamic aesthetic.\nTechnique - 1960s , Freeze Frame , Haze , Photography\nDirector - Dave Meyers\nDOP - Scott Cunningham\nEditor - Jai Shukla\nColorist - Dante Pasquinelli\nOriginal Source - Link\nBEACH\nSAND\nWALKING\nPOSE\nSABRINA CARPENTER\nMARILYN MONROE",
      "page_url": "https://eyecannndy.com/technique/haze"
    },
    {
      "video_url": "https://asset.eyecannndy.com/media/clip/2024/09/12/261726174531.webp",
      "alt_text": "M.I.A. 'Bad Girls'",
      "discovered_at": "2025-09-11T14:58:30.275636",
      "title": "M.I.A. 'Bad Girls' (2012)",
      "description": "M.I.A.'s \"Bad Girls\" music video is a visually stunning showcase of Saudi-inspired car stunts, with drifting vehicles on two wheels and empowered women in a desert setting, blending Middle Eastern cultural elements with modern rebellion. Directed by Romain Gavras, the video highlights themes of female empowerment and defiance, all set against a backdrop of high-octane action and surreal imagery.",
      "tags": [
        "DAY",
        "RACING",
        "EXTERIOR",
        "DESERT",
        "CARS",
        "HAZE",
        "HOT",
        "MOROCCO",
        "HEAT SHIMMER",
        "HEAT HAZE"
      ],
      "technique_tags": [
        "Distortions",
        "Haze"
      ],
      "director": "Walter Mauriot",
      "dop": "André Chemetoff",
      "colorist": "",
      "original_source": "",
      "additional_info": "M.I.A. 'Bad Girls' (2012)\nM.I.A.'s \"Bad Girls\" music video is a visually stunning showcase of Saudi-inspired car stunts, with drifting vehicles on two wheels and empowered women in a desert setting, blending Middle Eastern cultural elements with modern rebellion. Directed by Romain Gavras, the video highlights themes of female empowerment and defiance, all set against a backdrop of high-octane action and surreal imagery.\nTechnique - Distortions , Haze\nDirector - Romain Gavras\nDOP - André Chemetoff\nEditor - Walter Mauriot\nOriginal Source - Link\nTutorial - Link\nDAY\nRACING\nEXTERIOR\nDESERT\nCARS\nHAZE\nHOT\nMOROCCO\nHEAT SHIMMER\nHEAT HAZE",
      "page_url": "https://eyecannndy.com/technique/haze"
    },
    {
      "video_url": "https://asset.eyecannndy.com/media/clip/2024/09/12/261726174672.webp",
      "alt_text": "M.I.A. 'Bad Girls'",
      "discovered_at": "2025-09-11T14:58:34.471818",
      "title": "M.I.A. 'Bad Girls' (2012)",
      "description": "M.I.A.'s \"Bad Girls\" music video is a visually stunning showcase of Saudi-inspired car stunts, with drifting vehicles on two wheels and empowered women in a desert setting, blending Middle Eastern cultural elements with modern rebellion. Directed by Romain Gavras, the video highlights themes of female empowerment and defiance, all set against a backdrop of high-octane action and surreal imagery.",
      "tags": [
        "HAZE"
      ],
      "technique_tags": [
        "Distortions",
        "Haze"
      ],
      "director": "Walter Mauriot",
      "dop": "André Chemetoff",
      "colorist": "",
      "original_source": "",
      "additional_info": "M.I.A. 'Bad Girls' (2012)\nM.I.A.'s \"Bad Girls\" music video is a visually stunning showcase of Saudi-inspired car stunts, with drifting vehicles on two wheels and empowered women in a desert setting, blending Middle Eastern cultural elements with modern rebellion. Directed by Romain Gavras, the video highlights themes of female empowerment and defiance, all set against a backdrop of high-octane action and surreal imagery.\nTechnique - Distortions , Haze\nDirector - Romain Gavras\nDOP - André Chemetoff\nEditor - Walter Mauriot\nOriginal Source - Link\nTutorial - Link\nHAZE",
      "page_url": "https://eyecannndy.com/technique/haze"
    }
  ]
}