{
  "technique": "projections",
  "scrape_info": {
    "timestamp": "20250912_012303",
    "total_videos": 48,
    "scraper_type": "comprehensive_popup_modal"
  },
  "videos": [
    {
      "video_url": "https://asset.eyecannndy.com/media/clip/2024/01/28/261706403219.webp",
      "alt_text": "Omote",
      "discovered_at": "2025-09-12T01:20:18.491283",
      "title": "Omote (2014)",
      "description": "",
      "tags": [],
      "technique_tags": [
        "Projections"
      ],
      "director": "Nobumichi Asai",
      "dop": "",
      "colorist": "",
      "original_source": "",
      "additional_info": "Omote (2014)\nProjection mapping technique from director and artist, Nobumichi Asai.\nTechnique - Projections\nDirector - Nobumichi Asai\nOriginal Source - Link",
      "page_url": "https://eyecannndy.com/technique/projections"
    },
    {
      "video_url": "https://asset.eyecannndy.com/media/clip/2024/01/28/261706403032.webp",
      "alt_text": "Downtown Kayoto - Changed it",
      "discovered_at": "2025-09-12T01:20:21.634336",
      "title": "Downtown Kayoto - Changed it (2023)",
      "description": "",
      "tags": [
        "NIGHT",
        "DUSK",
        "EXTERIOR",
        "PROJECTION"
      ],
      "technique_tags": [
        "Projections"
      ],
      "director": "Joe Howat",
      "dop": "",
      "colorist": "",
      "original_source": "",
      "additional_info": "Downtown Kayoto - Changed it (2023)\nJoe Howat's sophomore music video features a variety of well-crafted techniques for London artist Downtown Kayoto.\nTechnique - Projections\nDirector - Joe Howat\nOriginal Source - Link\nNIGHT\nDUSK\nEXTERIOR\nPROJECTION",
      "page_url": "https://eyecannndy.com/technique/projections"
    },
    {
      "video_url": "https://asset.eyecannndy.com/media/clip/2025/02/10/261739169178.webp",
      "alt_text": "GIVĒON - TWENTIES",
      "discovered_at": "2025-09-12T01:20:24.746636",
      "title": "GIVĒON - TWENTIES (2025)",
      "description": "",
      "tags": [
        "GIVĒON - TWENTIES (2025)",
        "SURREAL",
        "BED",
        "SURREALISM",
        "BLACK",
        "TV",
        "VOID"
      ],
      "technique_tags": [
        "Projections",
        "Video Portraits",
        "Void"
      ],
      "director": "Jacob McKee",
      "dop": "Edouard Le Grelle",
      "colorist": "",
      "original_source": "",
      "additional_info": "GIVĒON - TWENTIES (2025)\nA cinematic reflection on youth, ambition, and the bittersweet passage of time. Directed by Loris Russier, with stunning cinematography by Edouard Le Grelle and rich, moody color grading by Jacob McKee, the video immerses viewers in a visually striking journey through late-night cityscapes, fleeting romance, and moments of introspection. Blending elegance with raw emotion, \"Twenties\" captures the highs and lows of coming of age, wrapped in GIVĒON’s signature soulful sound. Director - @lorisrussier Production Company - @lotumn_ Executive Producer / Producer - @autumnmaschi Executive Producer - @lorisrussier Director Of Photography - @edlegrelle Creative Director: @riko_akme Giveon Stylist - @yashuasimmons Management - @eeekksss, Simon Gebrelul Epic Head of Video Production - @gstarsz Starring - @ayomideadeduro\nTechnique - Projections , Video Portraits , Void\nDirector - Loris Russier\nDOP - Edouard Le Grelle\nEditor - Jacob McKee\nOriginal Source - Link\nSURREAL\nBED\n",
      "page_url": "https://eyecannndy.com/technique/projections"
    },
    {
      "video_url": "https://asset.eyecannndy.com/media/clip/2024/01/28/261706402995.webp",
      "alt_text": "Downtown Kayoto - Changed it",
      "discovered_at": "2025-09-12T01:20:27.873178",
      "title": "Downtown Kayoto - Changed it (2023)",
      "description": "",
      "tags": [
        "NIGHT",
        "DUSK",
        "EXTERIOR",
        "PROJECTION"
      ],
      "technique_tags": [
        "Projections"
      ],
      "director": "Joe Howat",
      "dop": "",
      "colorist": "",
      "original_source": "",
      "additional_info": "Downtown Kayoto - Changed it (2023)\nJoe Howat's sophomore music video features a variety of well-crafted techniques for London artist Downtown Kayoto.\nTechnique - Projections\nDirector - Joe Howat\nOriginal Source - Link\nNIGHT\nDUSK\nEXTERIOR\nPROJECTION",
      "page_url": "https://eyecannndy.com/technique/projections"
    },
    {
      "video_url": "https://asset.eyecannndy.com/media/clip/2024/03/12/261710224746.webp",
      "alt_text": "The Gentlemen (TV Series)",
      "discovered_at": "2025-09-12T01:20:31.504678",
      "title": "The Gentlemen (TV Series) (2024)",
      "description": "Season 1. Episode 4. Eddie Horniman inherits a family estate, initially unaware its home to a drug empire run by a syndicate that has no plans to vacate. Created by Guy Ritchie.",
      "tags": [
        "MALE",
        "INTERIOR",
        "CASTLE"
      ],
      "technique_tags": [
        "Projections",
        "Silhouette"
      ],
      "director": "Dan Sherwen, Matt Platts-Mills",
      "dop": "Bjorn Charpentier",
      "colorist": "Matthieu Toullet",
      "original_source": "",
      "additional_info": "The Gentlemen (TV Series) (2024)\nSeason 1. Episode 4. Eddie Horniman inherits a family estate, initially unaware its home to a drug empire run by a syndicate that has no plans to vacate. Created by Guy Ritchie.\nTechnique - Projections , Silhouette\nDirector - Nima Nourizadeh\nDOP - Bjorn Charpentier\nEditor - Dan Sherwen, Matt Platts-Mills\nColorist - Matthieu Toullet\nMALE\nINTERIOR\nCASTLE",
      "page_url": "https://eyecannndy.com/technique/projections"
    },
    {
      "video_url": "https://asset.eyecannndy.com/media/clip/2024/01/10/261704916539.webp",
      "alt_text": "João Borsch - Apaz",
      "discovered_at": "2025-09-12T01:20:35.126000",
      "title": "João Borsch - Apaz (2023)",
      "description": "Directed by – Inês Aires Co-direction – João Morgado Production – Inês Aires, João Borsch, Luís Silva Nunes Production Assistant – João Henrique Câmara Cinematography – Luís Silva Nunes 1st Camera Assistant – Duarte Lino Wardrobe – João Borsch, Inês Aires Makeup and Hair – Marta Saramago, Inês Aires Editing – João Morgado, Inês Aires Visual Effects – Inês Aires Color – Luís Silva Nunes Graphics - Daniel Bertini",
      "tags": [
        "VOID"
      ],
      "technique_tags": [
        "Projections"
      ],
      "director": "Inês Aires, João Morgado",
      "dop": "Luís Silva Nunes",
      "colorist": "",
      "original_source": "",
      "additional_info": "João Borsch - Apaz (2023)\nDirected by – Inês Aires Co-direction – João Morgado Production – Inês Aires, João Borsch, Luís Silva Nunes Production Assistant – João Henrique Câmara Cinematography – Luís Silva Nunes 1st Camera Assistant – Duarte Lino Wardrobe – João Borsch, Inês Aires Makeup and Hair – Marta Saramago, Inês Aires Editing – João Morgado, Inês Aires Visual Effects – Inês Aires Color – Luís Silva Nunes Graphics - Daniel Bertini\nTechnique - Projections\nDirector - Inês Aires, João Morgado\nDOP - Luís Silva Nunes\nOriginal Source - Link\nVOID",
      "page_url": "https://eyecannndy.com/technique/projections"
    },
    {
      "video_url": "https://asset.eyecannndy.com/media/clip/2025/02/10/261739169131.webp",
      "alt_text": "GIVĒON - TWENTIES",
      "discovered_at": "2025-09-12T01:20:38.750753",
      "title": "GIVĒON - TWENTIES (2025)",
      "description": "",
      "tags": [
        "GIVĒON - TWENTIES (2025)",
        "FACE",
        "COOL",
        "PROJECTION",
        "BLACK"
      ],
      "technique_tags": [
        "Projections"
      ],
      "director": "Jacob McKee",
      "dop": "Edouard Le Grelle",
      "colorist": "",
      "original_source": "",
      "additional_info": "GIVĒON - TWENTIES (2025)\nA cinematic reflection on youth, ambition, and the bittersweet passage of time. Directed by Loris Russier, with stunning cinematography by Edouard Le Grelle and rich, moody color grading by Jacob McKee, the video immerses viewers in a visually striking journey through late-night cityscapes, fleeting romance, and moments of introspection. Blending elegance with raw emotion, \"Twenties\" captures the highs and lows of coming of age, wrapped in GIVĒON’s signature soulful sound. Director - @lorisrussier Production Company - @lotumn_ Executive Producer / Producer - @autumnmaschi Executive Producer - @lorisrussier Director Of Photography - @edlegrelle Creative Director: @riko_akme Giveon Stylist - @yashuasimmons Management - @eeekksss, Simon Gebrelul Epic Head of Video Production - @gstarsz Starring - @ayomideadeduro\nTechnique - Projections\nDirector - Loris Russier\nDOP - Edouard Le Grelle\nEditor - Jacob McKee\nOriginal Source - Link\nFACE\nCOOL\nPROJECTION\nBLACK",
      "page_url": "https://eyecannndy.com/technique/projections"
    },
    {
      "video_url": "https://asset.eyecannndy.com/media/clip/2024/03/09/261709960327.webp",
      "alt_text": "Dune",
      "discovered_at": "2025-09-12T01:20:42.366654",
      "title": "Dune (2021)",
      "description": "A noble family becomes embroiled in a war for control over the galaxy's most valuable asset while its heir becomes troubled by visions of a dark future.",
      "tags": [
        "INTERIOR",
        "TIMOTHEE CHALAMET"
      ],
      "technique_tags": [
        "Projections"
      ],
      "director": "Joe Walker",
      "dop": "Greig Fraser",
      "colorist": "David Cole",
      "original_source": "",
      "additional_info": "Dune (2021)\nA noble family becomes embroiled in a war for control over the galaxy's most valuable asset while its heir becomes troubled by visions of a dark future.\nTechnique - Projections\nDirector - Denis Villeneuve\nDOP - Greig Fraser\nEditor - Joe Walker\nColorist - David Cole\nINTERIOR\nTIMOTHEE CHALAMET",
      "page_url": "https://eyecannndy.com/technique/projections"
    },
    {
      "video_url": "https://asset.eyecannndy.com/media/clip/2024/03/12/261710224697.webp",
      "alt_text": "The Gentlemen (TV Series)",
      "discovered_at": "2025-09-12T01:20:45.496861",
      "title": "The Gentlemen (TV Series) (2024)",
      "description": "Season 1. Episode 4. Eddie Horniman inherits a family estate, initially unaware its home to a drug empire run by a syndicate that has no plans to vacate. Created by Guy Ritchie.",
      "tags": [
        "INTERIOR",
        "CASTLE",
        "JAR",
        "GLASS JAR"
      ],
      "technique_tags": [
        "Halation",
        "Projections"
      ],
      "director": "Dan Sherwen, Matt Platts-Mills",
      "dop": "Bjorn Charpentier",
      "colorist": "Matthieu Toullet",
      "original_source": "",
      "additional_info": "The Gentlemen (TV Series) (2024)\nSeason 1. Episode 4. Eddie Horniman inherits a family estate, initially unaware its home to a drug empire run by a syndicate that has no plans to vacate. Created by Guy Ritchie.\nTechnique - Halation , Projections\nDirector - Nima Nourizadeh\nDOP - Bjorn Charpentier\nEditor - Dan Sherwen, Matt Platts-Mills\nColorist - Matthieu Toullet\nINTERIOR\nCASTLE\nJAR\nGLASS JAR",
      "page_url": "https://eyecannndy.com/technique/projections"
    },
    {
      "video_url": "https://asset.eyecannndy.com/media/clip/2024/01/28/261706403349.webp",
      "alt_text": "Inori - Prayer",
      "discovered_at": "2025-09-12T01:20:48.626085",
      "title": "Inori - Prayer (2017)",
      "description": "The latest work to utilize real time tracking and face projection mapping using a state of the art 1000 fps projector and ultra high speed sensing.",
      "tags": [
        "RED",
        "STUDIO",
        "PROJECTIONS"
      ],
      "technique_tags": [
        "Projections"
      ],
      "director": "Nobumichi Asai",
      "dop": "",
      "colorist": "",
      "original_source": "",
      "additional_info": "Inori - Prayer (2017)\nThe latest work to utilize real time tracking and face projection mapping using a state of the art 1000 fps projector and ultra high speed sensing.\nTechnique - Projections\nDirector - Nobumichi Asai\nOriginal Source - Link\nRED\nSTUDIO\nPROJECTIONS",
      "page_url": "https://eyecannndy.com/technique/projections"
    },
    {
      "video_url": "https://asset.eyecannndy.com/media/clip/2023/12/20/261703054602.webp",
      "alt_text": "The Fabelmans",
      "discovered_at": "2025-09-12T01:20:52.284124",
      "title": "The Fabelmans (2022)",
      "description": "Growing up in post-World War II era Arizona, young Sammy Fabelman aspires to become a filmmaker as he reaches adolescence, but soon discovers a shattering family secret and explores how the power of films can help him see the truth.",
      "tags": [
        "CLOSE UP",
        "NIGHT",
        "PROJECTION",
        "16MM",
        "ARRI ALEXA MINI LF",
        "KODAK 35MM",
        "PANAVISION PVINTAGE",
        "JOHN VLADIC",
        "STEVEN SPIELBERG",
        "SUPER 8MM",
        "SARAH BROSHAR",
        "MICHAEL KAHN"
      ],
      "technique_tags": [
        "Projections"
      ],
      "director": "Michael Kahn, Sarah Broshar",
      "dop": "Janusz Kamiński",
      "colorist": "John Vladic",
      "original_source": "",
      "additional_info": "The Fabelmans (2022)\nGrowing up in post-World War II era Arizona, young Sammy Fabelman aspires to become a filmmaker as he reaches adolescence, but soon discovers a shattering family secret and explores how the power of films can help him see the truth.\nTechnique - Projections\nDirector - Steven Spielberg\nDOP - Janusz Kamiński\nEditor - Michael Kahn, Sarah Broshar\nColorist - John Vladic\nCLOSE UP\nNIGHT\nPROJECTION\n16MM\nARRI ALEXA MINI LF\nKODAK 35MM\nPANAVISION PVINTAGE\nJOHN VLADIC\nSTEVEN SPIELBERG\nSUPER 8MM\nSARAH BROSHAR\nMICHAEL KAHN",
      "page_url": "https://eyecannndy.com/technique/projections"
    },
    {
      "video_url": "https://asset.eyecannndy.com/media/clip/2024/01/04/261704333151.webp",
      "alt_text": "Barstool Preachers - Above The Static",
      "discovered_at": "2025-09-12T01:20:55.391370",
      "title": "Barstool Preachers - Above The Static",
      "description": "",
      "tags": [
        "NIGHT",
        "BLACK AND WHITE",
        "EXTERIOR"
      ],
      "technique_tags": [
        "Projections"
      ],
      "director": "",
      "dop": "",
      "colorist": "",
      "original_source": "",
      "additional_info": "Barstool Preachers - Above The Static\nTechnique - Projections\nNIGHT\nBLACK AND WHITE\nEXTERIOR",
      "page_url": "https://eyecannndy.com/technique/projections"
    },
    {
      "video_url": "https://asset.eyecannndy.com/media/clip/2024/01/28/261706404026.webp",
      "alt_text": "Nike Jordan MELO Water Explosion",
      "discovered_at": "2025-09-12T01:20:58.538805",
      "title": "Nike Jordan MELO Water Explosion (2011)",
      "description": "Now iconic water projection stunt for the Jordan Melo 8.",
      "tags": [
        "WATER",
        "NIGHT",
        "EXTERIOR",
        "NEW YORK CITY",
        "HUDSON"
      ],
      "technique_tags": [
        "Projections"
      ],
      "director": "Show Cobra",
      "dop": "",
      "colorist": "",
      "original_source": "",
      "additional_info": "Nike Jordan MELO Water Explosion (2011)\nNow iconic water projection stunt for the Jordan Melo 8.\nTechnique - Projections\nEditor - Show Cobra\nOriginal Source - Link\nTutorial - Link\nWATER\nNIGHT\nEXTERIOR\nNEW YORK CITY\nHUDSON",
      "page_url": "https://eyecannndy.com/technique/projections"
    },
    {
      "video_url": "https://asset.eyecannndy.com/media/clip/2025/02/10/261739169766.webp",
      "alt_text": "GIVĒON - TWENTIES",
      "discovered_at": "2025-09-12T01:21:02.185878",
      "title": "GIVĒON - TWENTIES (2025)",
      "description": "",
      "tags": [
        "GIVĒON - TWENTIES (2025)"
      ],
      "technique_tags": [
        "Credits",
        "Projections",
        "Typography",
        "Void"
      ],
      "director": "Jacob McKee",
      "dop": "Edouard Le Grelle",
      "colorist": "",
      "original_source": "",
      "additional_info": "GIVĒON - TWENTIES (2025)\nA cinematic reflection on youth, ambition, and the bittersweet passage of time. Directed by Loris Russier, with stunning cinematography by Edouard Le Grelle and rich, moody color grading by Jacob McKee, the video immerses viewers in a visually striking journey through late-night cityscapes, fleeting romance, and moments of introspection. Blending elegance with raw emotion, \"Twenties\" captures the highs and lows of coming of age, wrapped in GIVĒON’s signature soulful sound. Director - @lorisrussier Production Company - @lotumn_ Executive Producer / Producer - @autumnmaschi Executive Producer - @lorisrussier Director Of Photography - @edlegrelle Creative Director: @riko_akme Giveon Stylist - @yashuasimmons Management - @eeekksss, Simon Gebrelul Epic Head of Video Production - @gstarsz Starring - @ayomideadeduro\nTechnique - Credits , Projections , Typography , Void\nDirector - Loris Russier\nDOP - Edouard Le Grelle\nEditor - Jacob McKee\nOriginal Source - Link",
      "page_url": "https://eyecannndy.com/technique/projections"
    },
    {
      "video_url": "https://asset.eyecannndy.com/media/clip/2024/01/28/261706403506.webp",
      "alt_text": "Hayden Thorpe - Aerial Songs",
      "discovered_at": "2025-09-12T01:21:05.853366",
      "title": "Hayden Thorpe - Aerial Songs (2021)",
      "description": "",
      "tags": [
        "SINGING",
        "GUITAR",
        "MUSICIAN"
      ],
      "technique_tags": [
        "Projections",
        "Silhouette"
      ],
      "director": "Rich Woolway",
      "dop": "Franklin Dow",
      "colorist": "Richard Fearon",
      "original_source": "",
      "additional_info": "Hayden Thorpe - Aerial Songs (2021)\n2021 music video for artist Hayden Thorpe from director Fiona Burgess. Features a beautifully simple use of projections throughout.\nTechnique - Projections , Silhouette\nDirector - Fiona Jane Burgess\nDOP - Franklin Dow\nEditor - Rich Woolway\nColorist - Richard Fearon\nOriginal Source - Link\nSINGING\nGUITAR\nMUSICIAN",
      "page_url": "https://eyecannndy.com/technique/projections"
    },
    {
      "video_url": "https://asset.eyecannndy.com/media/clip/2025/02/10/261739169568.webp",
      "alt_text": "GIVĒON - TWENTIES",
      "discovered_at": "2025-09-12T01:21:08.993920",
      "title": "GIVĒON - TWENTIES (2025)",
      "description": "",
      "tags": [
        "GIVĒON - TWENTIES (2025)",
        "COUPLE",
        "COUCH"
      ],
      "technique_tags": [
        "Projections",
        "Void"
      ],
      "director": "Jacob McKee",
      "dop": "Edouard Le Grelle",
      "colorist": "",
      "original_source": "",
      "additional_info": "GIVĒON - TWENTIES (2025)\nA cinematic reflection on youth, ambition, and the bittersweet passage of time. Directed by Loris Russier, with stunning cinematography by Edouard Le Grelle and rich, moody color grading by Jacob McKee, the video immerses viewers in a visually striking journey through late-night cityscapes, fleeting romance, and moments of introspection. Blending elegance with raw emotion, \"Twenties\" captures the highs and lows of coming of age, wrapped in GIVĒON’s signature soulful sound. Director - @lorisrussier Production Company - @lotumn_ Executive Producer / Producer - @autumnmaschi Executive Producer - @lorisrussier Director Of Photography - @edlegrelle Creative Director: @riko_akme Giveon Stylist - @yashuasimmons Management - @eeekksss, Simon Gebrelul Epic Head of Video Production - @gstarsz Starring - @ayomideadeduro\nTechnique - Projections , Void\nDirector - Loris Russier\nDOP - Edouard Le Grelle\nEditor - Jacob McKee\nOriginal Source - Link\nCOUPLE\nCOUCH",
      "page_url": "https://eyecannndy.com/technique/projections"
    },
    {
      "video_url": "https://asset.eyecannndy.com/media/clip/2024/03/12/261710224908.webp",
      "alt_text": "The Gentlemen (TV Series)",
      "discovered_at": "2025-09-12T01:21:12.659626",
      "title": "The Gentlemen (TV Series) (2024)",
      "description": "Season 1. Episode 4. Eddie Horniman inherits a family estate, initially unaware its home to a drug empire run by a syndicate that has no plans to vacate. Created by Guy Ritchie.",
      "tags": [
        "MALE",
        "INTERIOR",
        "GUN"
      ],
      "technique_tags": [
        "Projections"
      ],
      "director": "Dan Sherwen, Matt Platts-Mills",
      "dop": "Bjorn Charpentier",
      "colorist": "Matthieu Toullet",
      "original_source": "",
      "additional_info": "The Gentlemen (TV Series) (2024)\nSeason 1. Episode 4. Eddie Horniman inherits a family estate, initially unaware its home to a drug empire run by a syndicate that has no plans to vacate. Created by Guy Ritchie.\nTechnique - Projections\nDirector - Nima Nourizadeh\nDOP - Bjorn Charpentier\nEditor - Dan Sherwen, Matt Platts-Mills\nColorist - Matthieu Toullet\nMALE\nINTERIOR\nGUN",
      "page_url": "https://eyecannndy.com/technique/projections"
    },
    {
      "video_url": "https://asset.eyecannndy.com/media/clip/2024/01/28/261706403532.webp",
      "alt_text": "Hayden Thorpe - Aerial Songs",
      "discovered_at": "2025-09-12T01:21:16.336313",
      "title": "Hayden Thorpe - Aerial Songs (2021)",
      "description": "",
      "tags": [
        "INTERIOR",
        "STUDIO",
        "SINGING",
        "GUITAR",
        "WAREHOUSE",
        "MUSICIAN"
      ],
      "technique_tags": [
        "Projections",
        "Silhouette"
      ],
      "director": "Rich Woolway",
      "dop": "Franklin Dow",
      "colorist": "Richard Fearon",
      "original_source": "",
      "additional_info": "Hayden Thorpe - Aerial Songs (2021)\n2021 music video for artist Hayden Thorpe from director Fiona Burgess. Features a beautifully simple use of projections throughout.\nTechnique - Projections , Silhouette\nDirector - Fiona Jane Burgess\nDOP - Franklin Dow\nEditor - Rich Woolway\nColorist - Richard Fearon\nOriginal Source - Link\nINTERIOR\nSTUDIO\nSINGING\nGUITAR\nWAREHOUSE\nMUSICIAN",
      "page_url": "https://eyecannndy.com/technique/projections"
    },
    {
      "video_url": "https://asset.eyecannndy.com/media/clip/2024/01/28/261706403562.webp",
      "alt_text": "Hayden Thorpe - Aerial Songs",
      "discovered_at": "2025-09-12T01:21:20.008998",
      "title": "Hayden Thorpe - Aerial Songs (2021)",
      "description": "",
      "tags": [
        "INTERIOR",
        "STUDIO",
        "SINGING",
        "GUITAR",
        "WAREHOUSE",
        "MUSICIAN"
      ],
      "technique_tags": [
        "Projections",
        "Silhouette"
      ],
      "director": "Rich Woolway",
      "dop": "Franklin Dow",
      "colorist": "Richard Fearon",
      "original_source": "",
      "additional_info": "Hayden Thorpe - Aerial Songs (2021)\n2021 music video for artist Hayden Thorpe from director Fiona Burgess. Features a beautifully simple use of projections throughout.\nTechnique - Projections , Silhouette\nDirector - Fiona Jane Burgess\nDOP - Franklin Dow\nEditor - Rich Woolway\nColorist - Richard Fearon\nOriginal Source - Link\nINTERIOR\nSTUDIO\nSINGING\nGUITAR\nWAREHOUSE\nMUSICIAN",
      "page_url": "https://eyecannndy.com/technique/projections"
    },
    {
      "video_url": "https://asset.eyecannndy.com/media/clip/2025/02/10/261739168847.webp",
      "alt_text": "GIVĒON - TWENTIES",
      "discovered_at": "2025-09-12T01:21:23.650993",
      "title": "GIVĒON - TWENTIES (2025)",
      "description": "",
      "tags": [
        "GIVĒON - TWENTIES (2025)",
        "FACE",
        "PROJECTION"
      ],
      "technique_tags": [
        "Projections"
      ],
      "director": "Jacob McKee",
      "dop": "Edouard Le Grelle",
      "colorist": "",
      "original_source": "",
      "additional_info": "GIVĒON - TWENTIES (2025)\nA cinematic reflection on youth, ambition, and the bittersweet passage of time. Directed by Loris Russier, with stunning cinematography by Edouard Le Grelle and rich, moody color grading by Jacob McKee, the video immerses viewers in a visually striking journey through late-night cityscapes, fleeting romance, and moments of introspection. Blending elegance with raw emotion, \"Twenties\" captures the highs and lows of coming of age, wrapped in GIVĒON’s signature soulful sound. Director - @lorisrussier Production Company - @lotumn_ Executive Producer / Producer - @autumnmaschi Executive Producer - @lorisrussier Director Of Photography - @edlegrelle Creative Director: @riko_akme Giveon Stylist - @yashuasimmons Management - @eeekksss, Simon Gebrelul Epic Head of Video Production - @gstarsz Starring - @ayomideadeduro\nTechnique - Projections\nDirector - Loris Russier\nDOP - Edouard Le Grelle\nEditor - Jacob McKee\nOriginal Source - Link\nFACE\nPROJECTION",
      "page_url": "https://eyecannndy.com/technique/projections"
    },
    {
      "video_url": "https://asset.eyecannndy.com/media/clip/2025/02/10/261739168954.webp",
      "alt_text": "GIVĒON - TWENTIES",
      "discovered_at": "2025-09-12T01:21:27.318130",
      "title": "GIVĒON - TWENTIES (2025)",
      "description": "",
      "tags": [
        "GIVĒON - TWENTIES (2025)",
        "FACE",
        "PROJECTION"
      ],
      "technique_tags": [
        "Projections"
      ],
      "director": "Jacob McKee",
      "dop": "Edouard Le Grelle",
      "colorist": "",
      "original_source": "",
      "additional_info": "GIVĒON - TWENTIES (2025)\nA cinematic reflection on youth, ambition, and the bittersweet passage of time. Directed by Loris Russier, with stunning cinematography by Edouard Le Grelle and rich, moody color grading by Jacob McKee, the video immerses viewers in a visually striking journey through late-night cityscapes, fleeting romance, and moments of introspection. Blending elegance with raw emotion, \"Twenties\" captures the highs and lows of coming of age, wrapped in GIVĒON’s signature soulful sound. Director - @lorisrussier Production Company - @lotumn_ Executive Producer / Producer - @autumnmaschi Executive Producer - @lorisrussier Director Of Photography - @edlegrelle Creative Director: @riko_akme Giveon Stylist - @yashuasimmons Management - @eeekksss, Simon Gebrelul Epic Head of Video Production - @gstarsz Starring - @ayomideadeduro\nTechnique - Projections\nDirector - Loris Russier\nDOP - Edouard Le Grelle\nEditor - Jacob McKee\nOriginal Source - Link\nFACE\nPROJECTION",
      "page_url": "https://eyecannndy.com/technique/projections"
    },
    {
      "video_url": "https://asset.eyecannndy.com/media/clip/2024/01/28/261706403338.webp",
      "alt_text": "Inori - Prayer",
      "discovered_at": "2025-09-12T01:21:30.961508",
      "title": "Inori - Prayer (2017)",
      "description": "The latest work to utilize real time tracking and face projection mapping using a state of the art 1000 fps projector and ultra high speed sensing.",
      "tags": [
        "RED",
        "STUDIO",
        "PROJECTIONS"
      ],
      "technique_tags": [
        "Projections"
      ],
      "director": "Nobumichi Asai",
      "dop": "",
      "colorist": "",
      "original_source": "",
      "additional_info": "Inori - Prayer (2017)\nThe latest work to utilize real time tracking and face projection mapping using a state of the art 1000 fps projector and ultra high speed sensing.\nTechnique - Projections\nDirector - Nobumichi Asai\nOriginal Source - Link\nRED\nSTUDIO\nPROJECTIONS",
      "page_url": "https://eyecannndy.com/technique/projections"
    },
    {
      "video_url": "https://asset.eyecannndy.com/media/clip/2024/01/28/231706464754.webp",
      "alt_text": "Source unknown",
      "discovered_at": "2025-09-12T01:21:34.090243",
      "title": "Source unknown",
      "description": "",
      "tags": [
        "COUPLE",
        "TWO SHOT",
        "DARK",
        "PROJECTION"
      ],
      "technique_tags": [
        "Projections"
      ],
      "director": "",
      "dop": "",
      "colorist": "",
      "original_source": "",
      "additional_info": "Source unknown\nKnow the source? Email jacobi@eycndy.com\nTechnique - Projections\nCOUPLE\nTWO SHOT\nDARK\nPROJECTION",
      "page_url": "https://eyecannndy.com/technique/projections"
    },
    {
      "video_url": "https://asset.eyecannndy.com/media/clip/2024/01/28/261706404056.webp",
      "alt_text": "Nike Jordan MELO Water Explosion",
      "discovered_at": "2025-09-12T01:21:37.733438",
      "title": "Nike Jordan MELO Water Explosion (2011)",
      "description": "Now iconic water projection stunt for the Jordan Melo 8.",
      "tags": [
        "WATER",
        "NIGHT",
        "EXTERIOR",
        "NEW YORK CITY",
        "HUDSON"
      ],
      "technique_tags": [
        "Projections"
      ],
      "director": "Show Cobra",
      "dop": "",
      "colorist": "",
      "original_source": "",
      "additional_info": "Nike Jordan MELO Water Explosion (2011)\nNow iconic water projection stunt for the Jordan Melo 8.\nTechnique - Projections\nEditor - Show Cobra\nOriginal Source - Link\nTutorial - Link\nWATER\nNIGHT\nEXTERIOR\nNEW YORK CITY\nHUDSON",
      "page_url": "https://eyecannndy.com/technique/projections"
    },
    {
      "video_url": "https://asset.eyecannndy.com/media/clip/2024/01/28/261706403695.webp",
      "alt_text": "Emmy Curl - Come Closer",
      "discovered_at": "2025-09-12T01:21:41.394191",
      "title": "Emmy Curl - Come Closer (2014)",
      "description": "One take, no post production, all in camera effects with projections. Directed by Nuno Barbosa Body Painting by João Tiago Fernandes Music by Emmy Curl Mix: João André",
      "tags": [
        "WOMAN",
        "CLOSE-UP"
      ],
      "technique_tags": [
        "Projections",
        "Void"
      ],
      "director": "Nuno Barbosa",
      "dop": "",
      "colorist": "",
      "original_source": "",
      "additional_info": "Emmy Curl - Come Closer (2014)\nOne take, no post production, all in camera effects with projections. Directed by Nuno Barbosa Body Painting by João Tiago Fernandes Music by Emmy Curl Mix: João André\nTechnique - Projections , Void\nDirector - Nuno Barbosa\nOriginal Source - Link\nWOMAN\nCLOSE-UP",
      "page_url": "https://eyecannndy.com/technique/projections"
    },
    {
      "video_url": "https://asset.eyecannndy.com/media/clip/2024/01/07/261704621607.webp",
      "alt_text": "Moving Image Fashion GIF By Dyan Jong",
      "discovered_at": "2025-09-12T01:21:45.059694",
      "title": "Moving Image Fashion GIF By Dyan Jong (2019)",
      "description": "",
      "tags": [
        "INTERIOR",
        "TWO SHOT",
        "DARK"
      ],
      "technique_tags": [
        "Projections",
        "Two Shot"
      ],
      "director": "Dylan Jong",
      "dop": "",
      "colorist": "",
      "original_source": "",
      "additional_info": "Moving Image Fashion GIF By Dyan Jong (2019)\nTechnique - Projections , Two Shot\nDirector - Dylan Jong\nOriginal Source - Link\nINTERIOR\nTWO SHOT\nDARK",
      "page_url": "https://eyecannndy.com/technique/projections"
    },
    {
      "video_url": "https://asset.eyecannndy.com/media/clip/2024/01/28/261706403024.webp",
      "alt_text": "Downtown Kayoto - Changed it",
      "discovered_at": "2025-09-12T01:21:48.711034",
      "title": "Downtown Kayoto - Changed it (2023)",
      "description": "",
      "tags": [
        "NIGHT",
        "DUSK",
        "EXTERIOR",
        "PROJECTION"
      ],
      "technique_tags": [
        "Projections"
      ],
      "director": "Joe Howat",
      "dop": "",
      "colorist": "",
      "original_source": "",
      "additional_info": "Downtown Kayoto - Changed it (2023)\nJoe Howat's sophomore music video features a variety of well-crafted techniques for London artist Downtown Kayoto.\nTechnique - Projections\nDirector - Joe Howat\nOriginal Source - Link\nNIGHT\nDUSK\nEXTERIOR\nPROJECTION",
      "page_url": "https://eyecannndy.com/technique/projections"
    },
    {
      "video_url": "https://asset.eyecannndy.com/media/clip/2025/02/10/261739168901.webp",
      "alt_text": "GIVĒON - TWENTIES",
      "discovered_at": "2025-09-12T01:21:52.358045",
      "title": "GIVĒON - TWENTIES (2025)",
      "description": "",
      "tags": [
        "GIVĒON - TWENTIES (2025)",
        "FACE",
        "PROJECTION"
      ],
      "technique_tags": [
        "Projections"
      ],
      "director": "Jacob McKee",
      "dop": "Edouard Le Grelle",
      "colorist": "",
      "original_source": "",
      "additional_info": "GIVĒON - TWENTIES (2025)\nA cinematic reflection on youth, ambition, and the bittersweet passage of time. Directed by Loris Russier, with stunning cinematography by Edouard Le Grelle and rich, moody color grading by Jacob McKee, the video immerses viewers in a visually striking journey through late-night cityscapes, fleeting romance, and moments of introspection. Blending elegance with raw emotion, \"Twenties\" captures the highs and lows of coming of age, wrapped in GIVĒON’s signature soulful sound. Director - @lorisrussier Production Company - @lotumn_ Executive Producer / Producer - @autumnmaschi Executive Producer - @lorisrussier Director Of Photography - @edlegrelle Creative Director: @riko_akme Giveon Stylist - @yashuasimmons Management - @eeekksss, Simon Gebrelul Epic Head of Video Production - @gstarsz Starring - @ayomideadeduro\nTechnique - Projections\nDirector - Loris Russier\nDOP - Edouard Le Grelle\nEditor - Jacob McKee\nOriginal Source - Link\nFACE\nPROJECTION",
      "page_url": "https://eyecannndy.com/technique/projections"
    },
    {
      "video_url": "https://asset.eyecannndy.com/media/clip/2023/12/20/261703030561.webp",
      "alt_text": "Atonement",
      "discovered_at": "2025-09-12T01:21:57.039060",
      "title": "Atonement (2007)",
      "description": "",
      "tags": [
        "NIGHT",
        "INTERIOR",
        "SILHOUETTE",
        "COOL",
        "WIDE SHOT",
        "PANAVISION",
        "35MM",
        "MOVIE THEATER",
        "1930S",
        "2000S",
        "ATONEMENT",
        "JOE WRIGHT",
        "ADAM INGLIS",
        "PAUL TOTHILL",
        "PROJECTIONS",
        "SEAMUS MCGARVEY"
      ],
      "technique_tags": [
        "Projections",
        "Wide shot"
      ],
      "director": "Paul Tothill",
      "dop": "Seamus McGarvey",
      "colorist": "Adam Inglis, Ray Cacket",
      "original_source": "",
      "additional_info": "Atonement (2007)\nTechnique - Projections , Wide shot\nDirector - Joe Wright\nDOP - Seamus McGarvey\nEditor - Paul Tothill\nColorist - Adam Inglis, Ray Cacket\nNIGHT\nINTERIOR\nSILHOUETTE\nCOOL\nWIDE SHOT\nPANAVISION\n35MM\nMOVIE THEATER\n1930S\n2000S\n2007\nATONEMENT\nJOE WRIGHT\nADAM INGLIS\nPAUL TOTHILL\nPROJECTIONS\nSEAMUS MCGARVEY",
      "page_url": "https://eyecannndy.com/technique/projections"
    },
    {
      "video_url": "https://asset.eyecannndy.com/media/clip/2024/01/10/261704915829.webp",
      "alt_text": "João Borsch - Apaz",
      "discovered_at": "2025-09-12T01:22:00.163989",
      "title": "João Borsch - Apaz (2023)",
      "description": "Directed by – Inês Aires Co-direction – João Morgado Production – Inês Aires, João Borsch, Luís Silva Nunes Production Assistant – João Henrique Câmara Cinematography – Luís Silva Nunes 1st Camera Assistant – Duarte Lino Wardrobe – João Borsch, Inês Aires Makeup and Hair – Marta Saramago, Inês Aires Editing – João Morgado, Inês Aires Visual Effects – Inês Aires Color – Luís Silva Nunes Graphics - Daniel Bertini",
      "tags": [
        "VOID"
      ],
      "technique_tags": [
        "Projections",
        "Void"
      ],
      "director": "Inês Aires, João Morgado",
      "dop": "Luís Silva Nunes",
      "colorist": "",
      "original_source": "",
      "additional_info": "João Borsch - Apaz (2023)\nDirected by – Inês Aires Co-direction – João Morgado Production – Inês Aires, João Borsch, Luís Silva Nunes Production Assistant – João Henrique Câmara Cinematography – Luís Silva Nunes 1st Camera Assistant – Duarte Lino Wardrobe – João Borsch, Inês Aires Makeup and Hair – Marta Saramago, Inês Aires Editing – João Morgado, Inês Aires Visual Effects – Inês Aires Color – Luís Silva Nunes Graphics - Daniel Bertini\nTechnique - Projections , Void\nDirector - Inês Aires, João Morgado\nDOP - Luís Silva Nunes\nOriginal Source - Link\nVOID",
      "page_url": "https://eyecannndy.com/technique/projections"
    },
    {
      "video_url": "https://asset.eyecannndy.com/media/clip/2024/02/11/261707684559.webp",
      "alt_text": "The Aviator",
      "discovered_at": "2025-09-12T01:22:03.780486",
      "title": "The Aviator (2004)",
      "description": "",
      "tags": [
        "INTERIOR",
        "AVIATOR"
      ],
      "technique_tags": [
        "Projections"
      ],
      "director": "Thelma Schoonmaker",
      "dop": "Robert Richardson",
      "colorist": "Stephen Nakamura",
      "original_source": "",
      "additional_info": "The Aviator (2004)\nA biopic depicting the early years of legendary director and aviator Howard Hughes' career from the late 1920s to the mid 1940s.\nTechnique - Projections\nDirector - Martin Scorsese\nDOP - Robert Richardson\nEditor - Thelma Schoonmaker\nColorist - Stephen Nakamura\nINTERIOR\nAVIATOR",
      "page_url": "https://eyecannndy.com/technique/projections"
    },
    {
      "video_url": "https://asset.eyecannndy.com/media/clip/2024/01/28/261706404243.webp",
      "alt_text": "Source unknown",
      "discovered_at": "2025-09-12T01:22:06.933636",
      "title": "Source unknown",
      "description": "",
      "tags": [
        "NIGHT",
        "EXTERIOR",
        "BUILDING"
      ],
      "technique_tags": [
        "Projections"
      ],
      "director": "",
      "dop": "",
      "colorist": "",
      "original_source": "",
      "additional_info": "Source unknown\nKnow the source? Email jacobi@eycndy.com\nTechnique - Projections\nNIGHT\nEXTERIOR\nBUILDING",
      "page_url": "https://eyecannndy.com/technique/projections"
    },
    {
      "video_url": "https://asset.eyecannndy.com/media/clip/2024/03/02/261709342701.webp",
      "alt_text": "AJ Tracey - Wifey Riddim 4",
      "discovered_at": "2025-09-12T01:22:10.604494",
      "title": "AJ Tracey - Wifey Riddim 4 (2024)",
      "description": "",
      "tags": [],
      "technique_tags": [
        "Floating UI",
        "Projections"
      ],
      "director": "Late Milk",
      "dop": "Mike Koziel",
      "colorist": "",
      "original_source": "",
      "additional_info": "AJ Tracey - Wifey Riddim 4 (2024)\nTechnique - Floating UI , Projections\nDirector - Late Milk\nDOP - Mike Koziel\nOriginal Source - Link",
      "page_url": "https://eyecannndy.com/technique/projections"
    },
    {
      "video_url": "https://asset.eyecannndy.com/media/clip/2024/01/28/261706403042.webp",
      "alt_text": "Downtown Kayoto - Changed it",
      "discovered_at": "2025-09-12T01:22:13.745480",
      "title": "Downtown Kayoto - Changed it (2023)",
      "description": "",
      "tags": [
        "NIGHT",
        "DUSK",
        "EXTERIOR",
        "PROJECTION"
      ],
      "technique_tags": [
        "Projections"
      ],
      "director": "Joe Howat",
      "dop": "",
      "colorist": "",
      "original_source": "",
      "additional_info": "Downtown Kayoto - Changed it (2023)\nJoe Howat's sophomore music video features a variety of well-crafted techniques for London artist Downtown Kayoto.\nTechnique - Projections\nDirector - Joe Howat\nOriginal Source - Link\nNIGHT\nDUSK\nEXTERIOR\nPROJECTION",
      "page_url": "https://eyecannndy.com/technique/projections"
    },
    {
      "video_url": "https://asset.eyecannndy.com/media/clip/2024/01/07/261704620569.webp",
      "alt_text": "Scanning Billie Eilish GIF By Dyan Jong",
      "discovered_at": "2025-09-12T01:22:17.378759",
      "title": "Scanning Billie Eilish GIF By Dyan Jong (2019)",
      "description": "",
      "tags": [
        "ORANGE",
        "BILLIE EILISH"
      ],
      "technique_tags": [
        "Projections"
      ],
      "director": "Dylan Jong",
      "dop": "",
      "colorist": "",
      "original_source": "",
      "additional_info": "Scanning Billie Eilish GIF By Dyan Jong (2019)\nTechnique - Projections\nDirector - Dylan Jong\nORANGE\nBILLIE EILISH",
      "page_url": "https://eyecannndy.com/technique/projections"
    },
    {
      "video_url": "https://asset.eyecannndy.com/media/clip/2024/01/28/261706403545.webp",
      "alt_text": "Hayden Thorpe - Aerial Songs",
      "discovered_at": "2025-09-12T01:22:21.018631",
      "title": "Hayden Thorpe - Aerial Songs (2021)",
      "description": "",
      "tags": [
        "INTERIOR",
        "STUDIO",
        "SINGING",
        "GUITAR",
        "WAREHOUSE",
        "MUSICIAN"
      ],
      "technique_tags": [
        "Projections",
        "Silhouette"
      ],
      "director": "Rich Woolway",
      "dop": "Franklin Dow",
      "colorist": "Richard Fearon",
      "original_source": "",
      "additional_info": "Hayden Thorpe - Aerial Songs (2021)\n2021 music video for artist Hayden Thorpe from director Fiona Burgess. Features a beautifully simple use of projections throughout.\nTechnique - Projections , Silhouette\nDirector - Fiona Jane Burgess\nDOP - Franklin Dow\nEditor - Rich Woolway\nColorist - Richard Fearon\nOriginal Source - Link\nINTERIOR\nSTUDIO\nSINGING\nGUITAR\nWAREHOUSE\nMUSICIAN",
      "page_url": "https://eyecannndy.com/technique/projections"
    },
    {
      "video_url": "https://asset.eyecannndy.com/media/clip/2024/05/20/261716236328.webp",
      "alt_text": "Flume feat. MAY-A - Say Nothing",
      "discovered_at": "2025-09-12T01:22:24.677936",
      "title": "Flume feat. MAY-A - Say Nothing (2022)",
      "description": "The music video for \"Say Nothing\" by Flume featuring MAY-A, directed by Michael Hili, offers a visually captivating and surreal experience. It includes psychedelic visuals, with Flume donning a bleach-blonde hairstyle and posing on motorcycles, while MAY-A is seen submerged in black sand. The video uses stark contrasts and vibrant colors to complement the song's themes of post-relationship clarity and emotional expression. This trippy and avant-garde style enhances the song's narrative, making it a standout piece in Flume's discography.",
      "tags": [
        "MASK",
        "PROJECTION MAPPING"
      ],
      "technique_tags": [
        "Projections",
        "Void"
      ],
      "director": "Ian Wallace",
      "dop": "Dimitri Zaunders, Kieran Fowler",
      "colorist": "Josh Bohoskey",
      "original_source": "",
      "additional_info": "Flume feat. MAY-A - Say Nothing (2022)\nThe music video for \"Say Nothing\" by Flume featuring MAY-A, directed by Michael Hili, offers a visually captivating and surreal experience. It includes psychedelic visuals, with Flume donning a bleach-blonde hairstyle and posing on motorcycles, while MAY-A is seen submerged in black sand. The video uses stark contrasts and vibrant colors to complement the song's themes of post-relationship clarity and emotional expression. This trippy and avant-garde style enhances the song's narrative, making it a standout piece in Flume's discography.\nTechnique - Projections , Void\nDirector - Michael Hili\nDOP - Dimitri Zaunders, Kieran Fowler\nEditor - Ian Wallace\nColorist - Josh Bohoskey\nOriginal Source - Link\nMASK\nPROJECTION MAPPING",
      "page_url": "https://eyecannndy.com/technique/projections"
    },
    {
      "video_url": "https://asset.eyecannndy.com/media/clip/2024/07/05/261720165546.webp",
      "alt_text": "Victoria Monet - Alright",
      "discovered_at": "2025-09-12T01:22:27.841180",
      "title": "Victoria Monet - Alright (2024)",
      "description": "The music video for \"Alright\" by Victoria Monét, directed by Dave Meyers, is a vibrant homage to Janet Jackson, featuring high-energy choreography and striking visuals. In the video, Monét channels Jackson's iconic style, wearing a black-and-white fedora and suit, and performing dynamic dance routines reminiscent of Jackson's 1990s and 2000s era. The video, choreographed by Sean Bankhead, showcases Monét's impressive dance skills and captures the essence of liberation and celebration. Made in collaboration with Jacobi Mehringer, Anna Arnell, and Mia Barnes.",
      "tags": [
        "BLUE",
        "EYE",
        "PUPIL",
        "VICTORIA MONET"
      ],
      "technique_tags": [
        "Bolt Cam",
        "Choreo",
        "Projections"
      ],
      "director": "Vinnie Hobbs",
      "dop": "Scott Cunningham",
      "colorist": "Dante Pasquinelli",
      "original_source": "",
      "additional_info": "Victoria Monet - Alright (2024)\nThe music video for \"Alright\" by Victoria Monét, directed by Dave Meyers, is a vibrant homage to Janet Jackson, featuring high-energy choreography and striking visuals. In the video, Monét channels Jackson's iconic style, wearing a black-and-white fedora and suit, and performing dynamic dance routines reminiscent of Jackson's 1990s and 2000s era. The video, choreographed by Sean Bankhead, showcases Monét's impressive dance skills and captures the essence of liberation and celebration. Made in collaboration with Jacobi Mehringer, Anna Arnell, and Mia Barnes.\nTechnique - Bolt Cam , Choreo , Projections\nDirector - Dave Meyers\nDOP - Scott Cunningham\nEditor - Vinnie Hobbs\nColorist - Dante Pasquinelli\nOriginal Source - Link\nBLUE\nEYE\nPUPIL\nVICTORIA MONET",
      "page_url": "https://eyecannndy.com/technique/projections"
    },
    {
      "video_url": "https://asset.eyecannndy.com/media/clip/2025/02/10/261739168807.webp",
      "alt_text": "GIVĒON - TWENTIES",
      "discovered_at": "2025-09-12T01:22:31.483426",
      "title": "GIVĒON - TWENTIES (2025)",
      "description": "",
      "tags": [
        "GIVĒON - TWENTIES (2025)",
        "MUSIC",
        "PROJECTION",
        "JAZZ"
      ],
      "technique_tags": [
        "Projections"
      ],
      "director": "Jacob McKee",
      "dop": "Edouard Le Grelle",
      "colorist": "",
      "original_source": "",
      "additional_info": "GIVĒON - TWENTIES (2025)\nA cinematic reflection on youth, ambition, and the bittersweet passage of time. Directed by Loris Russier, with stunning cinematography by Edouard Le Grelle and rich, moody color grading by Jacob McKee, the video immerses viewers in a visually striking journey through late-night cityscapes, fleeting romance, and moments of introspection. Blending elegance with raw emotion, \"Twenties\" captures the highs and lows of coming of age, wrapped in GIVĒON’s signature soulful sound. Director - @lorisrussier Production Company - @lotumn_ Executive Producer / Producer - @autumnmaschi Executive Producer - @lorisrussier Director Of Photography - @edlegrelle Creative Director: @riko_akme Giveon Stylist - @yashuasimmons Management - @eeekksss, Simon Gebrelul Epic Head of Video Production - @gstarsz Starring - @ayomideadeduro\nTechnique - Projections\nDirector - Loris Russier\nDOP - Edouard Le Grelle\nEditor - Jacob McKee\nOriginal Source - Link\nMUSIC\nPROJECTION\nJAZZ",
      "page_url": "https://eyecannndy.com/technique/projections"
    },
    {
      "video_url": "https://asset.eyecannndy.com/media/clip/2024/01/28/261706404042.webp",
      "alt_text": "Nike Jordan MELO Water Explosion",
      "discovered_at": "2025-09-12T01:22:35.143668",
      "title": "Nike Jordan MELO Water Explosion (2011)",
      "description": "Now iconic water projection stunt for the Jordan Melo 8.",
      "tags": [
        "WATER",
        "NIGHT",
        "EXTERIOR",
        "NEW YORK CITY",
        "HUDSON"
      ],
      "technique_tags": [
        "Projections"
      ],
      "director": "Show Cobra",
      "dop": "",
      "colorist": "",
      "original_source": "",
      "additional_info": "Nike Jordan MELO Water Explosion (2011)\nNow iconic water projection stunt for the Jordan Melo 8.\nTechnique - Projections\nEditor - Show Cobra\nOriginal Source - Link\nTutorial - Link\nWATER\nNIGHT\nEXTERIOR\nNEW YORK CITY\nHUDSON",
      "page_url": "https://eyecannndy.com/technique/projections"
    },
    {
      "video_url": "https://asset.eyecannndy.com/media/clip/2024/07/05/261720165486.webp",
      "alt_text": "Victoria Monet - Alright",
      "discovered_at": "2025-09-12T01:22:38.776281",
      "title": "Victoria Monet - Alright (2024)",
      "description": "The music video for \"Alright\" by Victoria Monét, directed by Dave Meyers, is a vibrant homage to Janet Jackson, featuring high-energy choreography and striking visuals. In the video, Monét channels Jackson's iconic style, wearing a black-and-white fedora and suit, and performing dynamic dance routines reminiscent of Jackson's 1990s and 2000s era. The video, choreographed by Sean Bankhead, showcases Monét's impressive dance skills and captures the essence of liberation and celebration. Made in collaboration with Jacobi Mehringer, Anna Arnell, and Mia Barnes.",
      "tags": [
        "BLUE",
        "EYE",
        "PUPIL",
        "VICTORIA MONET"
      ],
      "technique_tags": [
        "Choreo",
        "Projections"
      ],
      "director": "Vinnie Hobbs",
      "dop": "Scott Cunningham",
      "colorist": "Dante Pasquinelli",
      "original_source": "",
      "additional_info": "Victoria Monet - Alright (2024)\nThe music video for \"Alright\" by Victoria Monét, directed by Dave Meyers, is a vibrant homage to Janet Jackson, featuring high-energy choreography and striking visuals. In the video, Monét channels Jackson's iconic style, wearing a black-and-white fedora and suit, and performing dynamic dance routines reminiscent of Jackson's 1990s and 2000s era. The video, choreographed by Sean Bankhead, showcases Monét's impressive dance skills and captures the essence of liberation and celebration. Made in collaboration with Jacobi Mehringer, Anna Arnell, and Mia Barnes.\nTechnique - Choreo , Projections\nDirector - Dave Meyers\nDOP - Scott Cunningham\nEditor - Vinnie Hobbs\nColorist - Dante Pasquinelli\nOriginal Source - Link\nBLUE\nEYE\nPUPIL\nVICTORIA MONET",
      "page_url": "https://eyecannndy.com/technique/projections"
    },
    {
      "video_url": "https://asset.eyecannndy.com/media/clip/2024/01/28/261706403317.webp",
      "alt_text": "Inori - Prayer",
      "discovered_at": "2025-09-12T01:22:42.429793",
      "title": "Inori - Prayer (2017)",
      "description": "The latest work to utilize real time tracking and face projection mapping using a state of the art 1000 fps projector and ultra high speed sensing.",
      "tags": [
        "RED",
        "STUDIO",
        "PROJECTIONS"
      ],
      "technique_tags": [
        "Projections"
      ],
      "director": "Nobumichi Asai",
      "dop": "",
      "colorist": "",
      "original_source": "",
      "additional_info": "Inori - Prayer (2017)\nThe latest work to utilize real time tracking and face projection mapping using a state of the art 1000 fps projector and ultra high speed sensing.\nTechnique - Projections\nDirector - Nobumichi Asai\nOriginal Source - Link\nRED\nSTUDIO\nPROJECTIONS",
      "page_url": "https://eyecannndy.com/technique/projections"
    },
    {
      "video_url": "https://asset.eyecannndy.com/media/clip/2024/01/28/261706403057.webp",
      "alt_text": "Downtown Kayoto - Changed it",
      "discovered_at": "2025-09-12T01:22:45.545674",
      "title": "Downtown Kayoto - Changed it (2023)",
      "description": "",
      "tags": [
        "NIGHT",
        "DUSK",
        "EXTERIOR",
        "PROJECTION"
      ],
      "technique_tags": [
        "Projections"
      ],
      "director": "Joe Howat",
      "dop": "",
      "colorist": "",
      "original_source": "",
      "additional_info": "Downtown Kayoto - Changed it (2023)\nJoe Howat's sophomore music video features a variety of well-crafted techniques for London artist Downtown Kayoto.\nTechnique - Projections\nDirector - Joe Howat\nOriginal Source - Link\nNIGHT\nDUSK\nEXTERIOR\nPROJECTION",
      "page_url": "https://eyecannndy.com/technique/projections"
    },
    {
      "video_url": "https://asset.eyecannndy.com/media/clip/2024/01/28/261706403706.webp",
      "alt_text": "Emmy Curl - Come Closer",
      "discovered_at": "2025-09-12T01:22:48.658096",
      "title": "Emmy Curl - Come Closer (2014)",
      "description": "One take, no post production, all in camera effects with projections. Directed by Nuno Barbosa Body Painting by João Tiago Fernandes Music by Emmy Curl Mix: João André",
      "tags": [
        "WOMAN",
        "CLOSE-UP"
      ],
      "technique_tags": [
        "Projections",
        "Void"
      ],
      "director": "Nuno Barbosa",
      "dop": "",
      "colorist": "",
      "original_source": "",
      "additional_info": "Emmy Curl - Come Closer (2014)\nOne take, no post production, all in camera effects with projections. Directed by Nuno Barbosa Body Painting by João Tiago Fernandes Music by Emmy Curl Mix: João André\nTechnique - Projections , Void\nDirector - Nuno Barbosa\nOriginal Source - Link\nWOMAN\nCLOSE-UP",
      "page_url": "https://eyecannndy.com/technique/projections"
    },
    {
      "video_url": "https://asset.eyecannndy.com/media/clip/2024/01/28/261706404283.webp",
      "alt_text": "Downtown Kayoto - Lite",
      "discovered_at": "2025-09-12T01:22:52.294840",
      "title": "Downtown Kayoto - Lite (2023)",
      "description": "",
      "tags": [
        "DOWNTOWN KAYOTO",
        "NIGHT",
        "FOG",
        "HAZE"
      ],
      "technique_tags": [
        "Projections"
      ],
      "director": "Joe Howat",
      "dop": "Ethan Lodge",
      "colorist": "Mara Ciorba",
      "original_source": "",
      "additional_info": "Downtown Kayoto - Lite (2023)\nTechnique - Projections\nDirector - Joe Howat\nDOP - Ethan Lodge\nEditor - Joe Howat\nColorist - Mara Ciorba\nOriginal Source - Link\nDOWNTOWN KAYOTO\nNIGHT\nFOG\nHAZE",
      "page_url": "https://eyecannndy.com/technique/projections"
    },
    {
      "video_url": "https://asset.eyecannndy.com/media/clip/2024/02/14/261707896944.webp",
      "alt_text": "Jurassic Park",
      "discovered_at": "2025-09-12T01:22:55.902386",
      "title": "Jurassic Park (1993)",
      "description": "A pragmatic paleontologist touring an almost complete theme park on an island in Central America is tasked with protecting a couple of kids after a power failure causes the park's cloned dinosaurs to run loose.",
      "tags": [
        "NIGHT",
        "INTERIOR",
        "KITCHEN",
        "DINOSAUR"
      ],
      "technique_tags": [
        "1990s",
        "Projections"
      ],
      "director": "Michael Kahn",
      "dop": "Dean Cundey",
      "colorist": "Dale Caldwell",
      "original_source": "",
      "additional_info": "Jurassic Park (1993)\nA pragmatic paleontologist touring an almost complete theme park on an island in Central America is tasked with protecting a couple of kids after a power failure causes the park's cloned dinosaurs to run loose.\nTechnique - 1990s , Projections\nDirector - Steven Spielberg\nDOP - Dean Cundey\nEditor - Michael Kahn\nColorist - Dale Caldwell\nNIGHT\nINTERIOR\nKITCHEN\nDINOSAUR",
      "page_url": "https://eyecannndy.com/technique/projections"
    },
    {
      "video_url": "https://asset.eyecannndy.com/media/clip/2024/01/28/261706403678.webp",
      "alt_text": "Emmy Curl - Come Closer",
      "discovered_at": "2025-09-12T01:22:59.039887",
      "title": "Emmy Curl - Come Closer (2014)",
      "description": "One take, no post production, all in camera effects with projections. Directed by Nuno Barbosa Body Painting by João Tiago Fernandes Music by Emmy Curl Mix: João André",
      "tags": [
        "WOMAN",
        "CLOSE-UP"
      ],
      "technique_tags": [
        "Projections",
        "Void"
      ],
      "director": "Nuno Barbosa",
      "dop": "",
      "colorist": "",
      "original_source": "",
      "additional_info": "Emmy Curl - Come Closer (2014)\nOne take, no post production, all in camera effects with projections. Directed by Nuno Barbosa Body Painting by João Tiago Fernandes Music by Emmy Curl Mix: João André\nTechnique - Projections , Void\nDirector - Nuno Barbosa\nOriginal Source - Link\nWOMAN\nCLOSE-UP",
      "page_url": "https://eyecannndy.com/technique/projections"
    },
    {
      "video_url": "https://asset.eyecannndy.com/media/clip/2024/01/13/261705126665.webp",
      "alt_text": "@coralgarvey / Giphy",
      "discovered_at": "2025-09-12T01:23:03.242959",
      "title": "@coralgarvey / Giphy",
      "description": "",
      "tags": [],
      "technique_tags": [
        "Projections",
        "Void"
      ],
      "director": "",
      "dop": "",
      "colorist": "",
      "original_source": "",
      "additional_info": "@coralgarvey / Giphy\nTechnique - Projections , Void",
      "page_url": "https://eyecannndy.com/technique/projections"
    }
  ]
}