{
  "technique": "trip",
  "scrape_info": {
    "timestamp": "20250911_073900",
    "total_videos": 5,
    "scraper_type": "comprehensive_popup_modal"
  },
  "videos": [
    {
      "video_url": "https://asset.eyecannndy.com/media/clip/2024/03/22/261711139607.webp",
      "alt_text": "Aminé - Charmander",
      "discovered_at": "2025-09-11T07:38:45.990034",
      "title": "Aminé - Charmander (2021)",
      "description": "In the 2021 music video \"Charmander\" by Aminé, the artist retreats to a secluded cabin in the woods, symbolizing a quest for peace and introspection away from the pressures of fame. The video is characterized by a warm, earthy color palette and natural light, capturing the tranquil beauty of the forest setting. The nostalgic reference to Pokémon through the title \"Charmander\" adds a whimsical contrast to the mature themes of self-discovery and isolation.",
      "tags": [
        "MALE",
        "EXTERIOR",
        "DOOR",
        "DILATED"
      ],
      "technique_tags": [
        "Altered state",
        "Drug trip",
        "Fisheye"
      ],
      "director": "Will Tooke",
      "dop": "Ben Mullen",
      "colorist": "Andrew Francis",
      "original_source": "",
      "additional_info": "Aminé - Charmander (2021)\nIn the 2021 music video \"Charmander\" by Aminé, the artist retreats to a secluded cabin in the woods, symbolizing a quest for peace and introspection away from the pressures of fame. The video is characterized by a warm, earthy color palette and natural light, capturing the tranquil beauty of the forest setting. The nostalgic reference to Pokémon through the title \"Charmander\" adds a whimsical contrast to the mature themes of self-discovery and isolation.\nTechnique - Altered state , Drug trip , Fisheye\nDirector - Adam Daniel, Jack Begert\nDOP - Ben Mullen\nEditor - Will Tooke\nColorist - Andrew Francis\nOriginal Source - Link\nMALE\nEXTERIOR\nDOOR\nDILATED",
      "page_url": "https://eyecannndy.com/technique/trip"
    },
    {
      "video_url": "https://asset.eyecannndy.com/media/clip/2024/07/07/261720345029.webp",
      "alt_text": "Oddworld x Souly - wzf / maybach",
      "discovered_at": "2025-09-11T07:38:49.600893",
      "title": "Oddworld x Souly - wzf / maybach (2024)",
      "description": "The music video for \"WZF / Maybach\" by Oddworld x Souly is a visually striking and dynamic production. The video features high-energy performances and a mix of urban and futuristic aesthetics. With vibrant colors and fast-paced edits, the visual storytelling complements the rhythm and intensity of the track. The artists are showcased in various locations, including industrial backdrops and sleek, modern settings, adding to the video's edgy and stylish vibe. The direction creatively blends elements of hip-hop culture with innovative visual effects, making it a captivating watch from start to finish.",
      "tags": [
        "GRAIN",
        "THERMAL"
      ],
      "technique_tags": [
        "Altered state",
        "Drug trip",
        "Thermal"
      ],
      "director": "Yannic Nixdorf",
      "dop": "Patrick Pichler",
      "colorist": "",
      "original_source": "",
      "additional_info": "Oddworld x Souly - wzf / maybach (2024)\nThe music video for \"WZF / Maybach\" by Oddworld x Souly is a visually striking and dynamic production. The video features high-energy performances and a mix of urban and futuristic aesthetics. With vibrant colors and fast-paced edits, the visual storytelling complements the rhythm and intensity of the track. The artists are showcased in various locations, including industrial backdrops and sleek, modern settings, adding to the video's edgy and stylish vibe. The direction creatively blends elements of hip-hop culture with innovative visual effects, making it a captivating watch from start to finish.\nTechnique - Altered state , Drug trip , Thermal\nDirector - Florian Christopher, Grotesk.Group\nDOP - Patrick Pichler\nEditor - Yannic Nixdorf\nOriginal Source - Link\nGRAIN\nTHERMAL",
      "page_url": "https://eyecannndy.com/technique/trip"
    },
    {
      "video_url": "https://asset.eyecannndy.com/media/clip/2024/02/11/261707631827.webp",
      "alt_text": "Valentino Khan - Deep Down Low",
      "discovered_at": "2025-09-11T07:38:53.336087",
      "title": "Valentino Khan - Deep Down Low (2016)",
      "description": "One of the weirdest music videos you'll ever watch. We don't recommend watching while high. Actually scratch that. Even better when high. Fever, hallucinogens, or the hypnotic beat at the track make his nightmares increasingly bizarre. In the restaurant, dancing facial features and tentacles sprouting from a waitress's eyes push him to flee the surreal scene.",
      "tags": [
        "WOMAN",
        "RESTAURANT",
        "INTERIOR",
        "HORROR",
        "OCTOPUS",
        "TENTACLES",
        "SQUID"
      ],
      "technique_tags": [
        "Altered state",
        "Drug trip",
        "Magical realism"
      ],
      "director": "Gaia Borretti",
      "dop": "Naoki Noda",
      "colorist": "Luke Morrison",
      "original_source": "",
      "additional_info": "Valentino Khan - Deep Down Low (2016)\nOne of the weirdest music videos you'll ever watch. We don't recommend watching while high. Actually scratch that. Even better when high. Fever, hallucinogens, or the hypnotic beat at the track make his nightmares increasingly bizarre. In the restaurant, dancing facial features and tentacles sprouting from a waitress's eyes push him to flee the surreal scene.\nTechnique - Altered state , Drug trip , Magical realism\nDirector - Ian Pons Jewell\nDOP - Naoki Noda\nEditor - Gaia Borretti\nColorist - Luke Morrison\nOriginal Source - Link\nWOMAN\nRESTAURANT\nINTERIOR\nHORROR\nOCTOPUS\nTENTACLES\nSQUID",
      "page_url": "https://eyecannndy.com/technique/trip"
    },
    {
      "video_url": "https://asset.eyecannndy.com/media/clip/2024/02/11/261707622716.webp",
      "alt_text": "A$AP Rocky - L$D",
      "discovered_at": "2025-09-11T07:38:57.104352",
      "title": "A$AP Rocky - L$D (2015)",
      "description": "Shot entirely in Tokyo, L$D borrows heavily from Gaspar Noé’s 2009 psychedelic fantasy film Enter the Void (which, if you ask Noé, also inspired Kanye West’s 2010 music video “All of the Lights”).",
      "tags": [],
      "technique_tags": [
        "Altered state",
        "Drug trip",
        "Light Flash",
        "Towards camera",
        "Tracking"
      ],
      "director": "Dexter Navy",
      "dop": "Oliver Millar",
      "colorist": "Matt Turner",
      "original_source": "",
      "additional_info": "A$AP Rocky - L$D (2015)\nShot entirely in Tokyo, L$D borrows heavily from Gaspar Noé’s 2009 psychedelic fantasy film Enter the Void (which, if you ask Noé, also inspired Kanye West’s 2010 music video “All of the Lights”).\nTechnique - Altered state , Drug trip , Light Flash , Towards camera , Tracking\nDirector - Dexter Navy\nDOP - Oliver Millar\nColorist - Matt Turner\nOriginal Source - Link\nTutorial - Link",
      "page_url": "https://eyecannndy.com/technique/trip"
    },
    {
      "video_url": "https://asset.eyecannndy.com/media/clip/2024/02/11/261707622253.webp",
      "alt_text": "A$AP Rocky - L$D",
      "discovered_at": "2025-09-11T07:39:00.737959",
      "title": "A$AP Rocky - L$D (2015)",
      "description": "Shot entirely in Tokyo, L$D borrows heavily from Gaspar Noé’s 2009 psychedelic fantasy film Enter the Void (which, if you ask Noé, also inspired Kanye West’s 2010 music video “All of the Lights”).",
      "tags": [],
      "technique_tags": [
        "Altered state",
        "Double Exposure",
        "Drug trip"
      ],
      "director": "Dexter Navy",
      "dop": "Oliver Millar",
      "colorist": "Matt Turner",
      "original_source": "",
      "additional_info": "A$AP Rocky - L$D (2015)\nShot entirely in Tokyo, L$D borrows heavily from Gaspar Noé’s 2009 psychedelic fantasy film Enter the Void (which, if you ask Noé, also inspired Kanye West’s 2010 music video “All of the Lights”).\nTechnique - Altered state , Double Exposure , Drug trip\nDirector - Dexter Navy\nDOP - Oliver Millar\nColorist - Matt Turner\nOriginal Source - Link\nTutorial - Link",
      "page_url": "https://eyecannndy.com/technique/trip"
    }
  ]
}